S.No,Item name,Brand_Name,Category,Sub_Category,Ingredients,Serving_Size_g,Calories_kcal,Carbohydrates_g,Proteins_g,Total_Fat_g,Saturated_Fat_g,Trans_Fat_g,Sugar_g,Sodium_mg,Dietary_Fiber_g,Cholesterol_mg,Calcium_mg,Vitamin,Iron_mg,Price_INR,Source_of_Data,Collection_Date,Collected_By,Remarks
349,Granamma Kara Boondi,GRANAMMA,SNACKS,NAMKEEN,"Gram Flour (Besan), Refined Vegetable Oil (Palmolein, Sunflower Oil, Groundnut Oil), Rice Flour, Groundnut, Cashew Nut, Dried Chilli, Dried Curry Leaves, Iodised Salt, Refined Sugar, Mixed Spices",100,567,46.3,10.9,38.9,5.3,0,0.4,429.5,0.4,0,0,0,0,60,,,,
350,Dev Kadalamavu Mixture,DEV SNACKS,SNACKS,MIXTURE,"Besan Powder, Ground Nut, Vegetable Oil, Curry Leaves, Chilly Powder, Asafoetida, Salt",100,597.41,30.12,20.3,40.2,0,0,0,62.16,3.6,0,0,0,0,120,,,,
351,Dev Snacks Ghee Murukku,DEV SNACKS,SNACKS,MURUKKU  ,"Rice Powder, Urid Dal, Ghee, Gingelly Jeera, Vegetable Oil & Salt",100,513.5,67.71,2.2,26.1,0,0,0,53.3,0,0,0,0,0,155,,,,
352,Bingo! Flat Cut Himalayan Pink Salt,BINGO,SNACKS,POTATOCHIPS,"Potato (63.8%), Refined Palmolein, Himalayan Pink Salt (1.6%), and Beet Root Powder",100,552,54.2,8.3,34.3,15.1,0.11,0.8,632.5,0,0,0,0,0,20,,,,
353,Lay's Potato Chips WAFERstyle - Salt with Pepper Flavour,LAY'S,SNACKS,POTATOCHIPS,"Potato, Edible Vegetable Oil (Palmolein Oil), Seasoning (Maltodextrin, Iodised Salt, Spices and Condiments, Sugar, Flavour (Natural and Nature Identical Flavouring Substances), Anticaking Agent (551), Flavour Enhancers (627, 631), Edible Vegetable Oil (Palm))",100,539,53.2,6.5,33.3,15,0.1,0.6,681,0,0,0,0,0,20,,,,
354,Modern Kitchens Wheel Chips,MODERN KITCHENS,SNACKS,MURUKKU ,"Wheat Flour, Edible Starch, Refined Vegetable Oil, Red Chilli, Coriander, Cumin, Turmeric, and Black Salt",100,352.2,74,7,0.5,0.25,0,<1,510,2,0,0,0,0,60,,,,
355,Nestle Munch Max Choco Coated Crunchy WAFERBar,NESTLE,CHOCOLATE,WAFERCHOCOLATE,"Sugar, Refined Wheat flour (Maida), Hydrogenated vegetable fats, Fractionated vegetable fat, Milk solids, Cocoa solids (3.9%), Emulsifier (Soya lecithin), Raising agent (500(ii)), Yeast, Iodised salt, Flour treatment agent (516), Artificial (VANILLA CAKE) flavouring substance and Nature-Identical flavouring substance",100,428,50,5.7,22.8,22.4,0.06,32.2,86.3,0,0,0,0,0,20,,,,
356,Cadbury Dairy Milk Chocolate Bar,CADBURY,CHOCOLATE,CHOCOLATE BAR,"Sugar, Milk Solids (23%), Cocoa Butter, Cocoa Solids, Emulsifiers (442, 476), Flavours (Natural, Nature Identical, and Artificial VANILLA CAKE)",100,531,60.4,7.9,29,19.6,0.1,57,129,0,20.7,0,0,0,30,,,,
357,Ferrero Rocher,FERRERO ROCHER,CHOCOLATE,MILK CHOCOLATE,"Milk Chocolate (30%) Sugar, Cocoa Butter, Cocoa Mass, Skimmed Milk Powder, Anhydrous Milkfat, Emulsifier Lecithin - Ins 322, Nature Identical Flavouring Substance - Vanillin), Hazelnuts (28.5%), Sugar, Palm Oil, Refined Wheat Flour Maida, Whey Powder, Low Fat Cocoa Powder, Emulsifier Lecithin Ins 322), Raising Agent (Ins 500Ii), Edible Common Salt, Nature Identical Flavouring Substance Vanillin",100,595,44.4,8.2,42.7,0,0,39.9,0,0,0,0,0,0,950,,,,
358,Cadbury 5 Star CHOCOLATE BAR,CADBURY,CHOCOLATE,CHOCOLATE BAR,"Sugar Boiled Confectionery. Ingredients: Sugar, Liquid Glucose, Milk Solids, Invert Sugar, Hydrogenated Oil, Cocoa Solids, Cocoa Butter, Fractionated Fat, Emulsifiers (442, 471, 476), Hydrolyzed Vegetable Protein, Iodised Salt, Flavours (Natural, Nature Identical And Artificial (Milk, Caramel And VANILLA CAKE) Flavouring Substances). Allergen Information: Contains Milk, Soy, Sulphites. May Contain Peanut, Wheat, Barley And Tree Nut.",100,444,72.9,3.3,15.9,10.1,0.1,55.5,170,0,4.9,0,0,0,20,,,,
359,Amul Chocominis Chocolate,AMUL,CHOCOLATE,CHOCOLATE,"Sugar, Hydrogenated Edible Vegetable Fat (Palm Kernel Oil), Milk Solids, Cocoa Solids, Permitted Emulsifiers (E492, E322), Contains Added VANILLA CAKE Flavour (Artificial Flavouring Substances)",100,545,60.7,5.5,31.2,27.1,0,51.1,0,0,0,0,0,0,140,,,,
360,Galaxy Cookie Crumble CHOCOLATE BAR,GALAXY,CHOCOLATE,CHOCOLATE BAR,"Milk chocolate (90%): sugar, milk solids, cocoa butter, cocoa solids, edible vegetable fats less than 5% (sal fat, palm oil), emulsifiers (322, 476), humectant (422). Cookies (10%): refined wheat flour (maida), sugar, edible vegetable fat (palm oil), fat reduced cocoa powder, butter, skimmed milk powder, liquid glucose, raising agents (503(ii), nature identical flavour. Contains vegetable addition to cocoa butter.",100,543,61.3,6.6,30.6,19.2,0.3,50.6,85.6,0,19,0,0,0,185,,,,
361,Galaxy Smooth Milk CHOCOLATE BAR,GALAXY,CHOCOLATE,CHOCOLATE BAR,"Sugar, Milk Solids, Cocoa Butter, Cocoa Solids, Edible Vegetable Fats, Humectant (422), Emulsifiers (322, 476)",100,553,60.2,6.4,32.2,20.3,0.1,48.3,43.01,0,6.62,0,0,0,199,,,,
362,Cadbury Dairy Milk Fruit & Nut CHOCOLATE BAR,CADBURY,CHOCOLATE,CHOCOLATE BAR,"Sugar, Milk Solids (18%), Cocoa Butter, Dry Fruit (Raisins (10%)), Cocoa Solids, Almonds (9%), Fractionated Fat, Emulsifiers (442, 476), Flavours (Natural, Nature Identical and Artificial (VANILLA CAKE) Flavouring Substances). Contains Cocoa Butter Equivalent In Addition To Cocoa Butter",100,520,58.8,8.5,28.4,16.4,<0.1,54.4,106,0,16.8,0,0,0,55,,,,
363,Hershey's Kisses Milk Chocolate,HERSHEYS,CHOCOLATE,CHOCOLATE,"Sugar, Milk Solids (27%), Cocoa Butter, Cocoa Solids, and Emulsifiers (INS 322(i) and INS 476)",100,525,60.5,9.08,27.5,16.3,0.37,45.8,0,0,0,0,0,0,60,,,,
364,Confetteria Raffaello Coconut and White Almond,CONFETTERIA RAFFAELLO,CHOCOLATE,CHOCOLATE,"Desiccated Coconut, Palm Oil, Sugar, Almond, Skimmed Milk Powder, Whey Powder, Shea Butter, Refined Wheat Flour (Maida), Tapioca Starch, Nature Identical Flavouring Substances, Emulsifier (Lecithin - INS 322), Raising Agent (INS 500ii), Edible Common Salt",100,627,38.6,7.4,48.3,29.5,0.2,33.6,105,0,6,0,0,0,495,,,,
365,Cadbury Dairy Milk Crispello CHOCOLATE BAR,CADBURY,CHOCOLATE,CHOCOLATE BAR,"Milk Chocolate 50%- Sugar, Milk Solids (11%), Cocoa Butter, Cocoa Solids, Emulsifiers (442, 476), Flavours (Natural, Nature Identical and Artificial (VANILLA CAKE) Flavouring Substances), Centre 50%- Sugar, Fractionated Fat, Wheat Crispies 11% (Refined Wheat Flour (Maida), Sugar, Corn Starch, Cocoa Solids, Iodised Salt, Palm Kernel Oil, Leavening Agents (450(I), 500(I), 341(I))), Corn Starch, Cocoa Solids, Emulsifiers (442, 476), Iodised Salt, and Artificial (VANILLA CAKE) Flavouring Substances",100,523,64.5,5.2,27.6,17.7,0.2,50.2,192,0,12.7,0,0,0,45,,,,
366,Twix Minis Cookie Caramel Chocolate Pack,TWIX,CHOCOLATE,CHOCOLATE BAR,"Sugar, Liquid Glucose, Refined Wheat Flour (Maida) (17%), Edible Vegetable Fat (Palm Fat), Milk Solids, Cocoa Butter, Cocoa Solids, Salt, Emulsifier (Ins 322), Raising Agent (Ins 500), and Natural Flavour (VANILLA CAKE)",100,493,66.8,4.6,23.7,13.9,0.13,48,158,0,4.2,0,0,0,169,,,,
367,"Sunfeast Fantastik Fruit n Nut, Chocolaty Bar",SUNFEAST,CHOCOLATE,CHOCOLATE BAR,"Sugar, Hydrogenated Vegetable Oil, Milk Solids, Almond Bits, Raisins, Cocoa Solids, Cashew Bits, Emulsifier (Lecithin From Soyabean), Nature Identical Flavouring Substances",100,546,60.6,8.2,30.5,25.1,0.05,41,130.1,0,0,0,0,0,50,,,,
368,Cadbury Dairy Milk Silk Oreo CHOCOLATE BAR,CADBURY,CHOCOLATE,CHOCOLATE BAR,"Milk Chocolate (50%)- Sugar, Milk Solids (13%), Cocoa Butter, Cocoa Solids, Emulsifiers (442, 476), Flavours (Natural, Nature Identical and Artificial (VANILLA CAKE) Flavouring Substances); Centre (50%)- Fractionated Fat, Biscuit 13% (Refined Wheat Flour (Maida), Sugar, Palmolein, Invert Sugar, Cocoa Solids, Leavening Agents (500(ii), 503(ii)), Iodised Salt, Emulsifier (322), Flavours (Artificial (VANILLA CAKE) Flavouring Substances)), Sugar, Milk Solids, Emulsifier (442), Flavours (Artificial (VANILLA CAKE) Flavouring Substances)",100,563,56.9,6,34.8,22.3,0.2,48.9,207,0,17.4,0,0,0,110,,,,
369,Eat Anytime Coffee Cinnamon Date Laddoo,EAT ANYTIME,CHOCOLATE,LADDU,"Dates, Almonds, Coconuts, Oats, Coffee, Chia Seeds, Sea Salt",100,474.8,49.9,14.3,24.2,5.7,0,30.5,87.2,8.9,0,0,0,0,149,,,,
370,Cadbury Nutties Chocolate,CADBURY,CHOCOLATE,CHOCOLATE,"Center (56%) (Sugar, Cashews (11%), Milk Solids, Glazing Agent (904), Stabilizers (1400, 414), lodised Salt, Flavours (Natural and Nature Identical Flavouring Substances), Emulsifier (442), Almond); Milk Chocolate (44%) (Sugar, Milk Solids (9%), Cocoa Butter, Cocoa Solids, Fractionated Fat, Emulsifiers (442, 476), Flavours (Natural, Nature Identical and Artificial (VANILLA CAKE) Flavouring Substances))",100,511,67.2,5,24.8,13.9,0.1,61.5,117,0,18,0,0,0,50,,,,
371,Nestle Milkybar Tablet Made With Milk Yummy & Creamy Treat,MILKY BAR,CHOCOLATE,CHOCOLATE BAR,"Milk Solids (35%), Sugar, Hydrogenated Vegetable Fats, Fractionated Vegetable Fat, Emulsifier (Soya Lecithin), Nature-identical Flavouring Substance",100,524,50.1,11.1,30,28.7,0.09,40.9,117.1,0,0,0,0,0,40,,,,
372,Snickers Peanut Filled CHOCOLATE BAR Loaded with Delicious Roasted Peanuts,SNICKERS,CHOCOLATE,CHOCOLATE BAR,"Sugar, Milk Solids, Cocoa Butter, Cocoa Solids, Edible Vegetable Fats (Sal Fat, Palm Oil), Dextrose, Emulsifier (INS 322), Liquid Glucose, Peanuts, Hydrogenated Vegetable Oil (Palm Oil), Iodized Salt",100,491,57.43,8.83,25.1,10.1,0.1,51.84,222,0,5.1,0,0,0,50,,,,
373,Cadbury Dairy Milk Silk Desserts Brownie CHOCOLATE BAR,CADBURY,CHOCOLATE,CHOCOLATE BAR,"Milk Chocolate (60%)- Sugar, Milk Solids, Cocoa Butter, Cocoa Solids, Emulsifiers (442, 476), Flavours (VANILLA CAKE); Centre (40%)- Walnuts (7%), Fractionated Fat, Sugar, Refined Wheat Flour (Maida), Cocoa Solids, Milk Solids, Interesterified Fat, Humectant (422), Water, Palmolein, Emulsifiers (322, 442, 476), Invert Sugar, Flavours (Brownie, VANILLA CAKE), Raising Agents (500(ii), 503(ii)), Iodized Salt, Antioxidant (307c)",100,557,50.9,8.1,36.3,17.8,0.1,40.6,141,0,23.2,0,0,0,140,,,,
374,Hershey's Creamy Milk CHOCOLATE BAR,HERSHEYS,CHOCOLATE,CHOCOLATE BAR,"Sugar, Milk Solids (28%), Cocoa Solids (17.7%), Cocoa Butter, Edible Vegetable Oil (Sunflower and Palm), Emulsifiers (322 (i), 476), Flavour (Artificial Flavouring Substance-Vanillin)",100,553,52.4,8.8,32.1,19,0.3,51.8,107.13,0,18.7,0,0,0,60,,,,
375,Hershey's Cookies 'N' Creme CHOCOLATE BAR,HERSHEYS,CHOCOLATE,CHOCOLATE BAR,"Sugar, edible vegetable oil (sunflower and palm oil), cookies (#19%) {refined wheat flour (maida), sugar, edible vegetable oil (palm oil), cocoa solids (#2%), emulsifier (322 (I)), milk solids, raising agent (500ii)}, milk solids (#18.6%), corn syrup solids, edible vegetable oil (palm and palm kernel oil), emulsifier (322 (I)) and flavor (artificial flavouring substance - vanillin)",100,522,65,5.5,26.7,16,0.24,48,136,0,4,0,0,0,65,,,,
376,Cadbury Dairy Milk Bites Hazelnut Chocolate Pack,CADBURY,CHOCOLATE,CHOCOLATE,"Milk Chocolate (Sugar, Milk Solids, Cocoa Butter, Cocoa Solids, Fractionated Fat, Emulsifiers (442, 476), Natural Flavours, Nature Identical and Artificial VANILLA CAKE Flavouring), Hazelnuts, Glazing Agent (904), Stabilizers (414, 1400), Sugar, Liquid Glucose",100,566,48.1,9.2,37.8,17,0.1,42.1,119,0,16.3,0,0,0,100,,,,
377,Hershey's Dark CHOCOLATE BAR,HERSHEYS,CHOCOLATE,CHOCOLATE BAR,"Sugar, Cocoa Solids, Cocoa Butter, Milk Solids, Emulsifiers, Flavour",100,535,62,5,29.7,18,0.2,52.3,14.5,0,8.8,0,0,0,65,,,,
378,"Galaxy Fusions Silky Smooth Dark CHOCOLATE BAR, Made with 70% Cocoa",GALAXY,CHOCOLATE,CHOCOLATE BAR,"Cocoa mass, Sugar, Cocoa butter, Emulsifiers: ins 322 (lecithin), Natural flavor: VANILLA CAKE, Cocoa content: Total cocoa content: 70%",100,568,30.8,7.5,43.1,25.8,0,27,6.4,0,0,0,0,0,70,,,,
379,Cadbury Dairy Milk Silk Bubbly CHOCOLATE BAR,CADBURY,CHOCOLATE,CHOCOLATE BAR,"Sugar, Milk Solids (25%), Cocoa Butter, Cocoa Solids, Emulsifiers (442, 476), Flavours (Natural, Nature Identical, and Artificial (VANILLA CAKE) Flavouring Substances)",100,543,58.5,7.6,31.4,21.5,0.1,55.3,125,0,27,0,0,0,100,,,,
380,Cadbury Dairy Milk Silk CHOCOLATE BAR,CADBURY,CHOCOLATE,CHOCOLATE,"Sugar, Milk Solids, Cocoa Butter, Cocoa Solids, Emulsifiers (442, 476), Natural Flavours, Nature Identical and Artificial VANILLA CAKE Flavouring Substances",100,543,58.5,7.6,31.4,21.5,0.1,55.3,125,0,26.7,0,0,0,110,,,,
381,Nestle KitKat Delights Rich,NESTLE,CHOCOLATE,CHOCOLATE,"Milk Chocolate (68.8) (Sugar, Milk solids (16.6), Cocoa butter (12), Cocoa solids (8.2), Emulsifier (Soya lecithin) & Artificial (VANILLA CAKE) flavouring substances), WAFER(Refined Wheat flour (Maida), Sugar, Hydrogenated vegetable fats, Cocoa solids (1.5), Milk solids, Fractionated vegetable fat, Yeast, Raising agent (500(ii)), Emulsifier (Soya lecithin), lodized salt, Flour treatment agent (516), Artificial (VANILLA CAKE) flavouring substances & Nature identical flavouring substances)",100,441,49.6,6.2,24.2,22.8,0.03,41.5,82.4,0,1.1,0,0,0,90,,,,
382,Cadbury Dairy Milk Silk Mousse CHOCOLATE BAR,CADBURY,CHOCOLATE,CHOCOLATE BAR,"Milk Chocolate 55%- Sugar, Milk Solids (13%), Cocoa Butter, Cocoa Solids, Emulsifiers (442, 476), Flavours (Natural, Nature Identical and Artificial (VANILLA CAKE) Flavouring Substances) Centre Filling 45%: Fractionated Fat, Sugar, Cocoa Solids, Milk Solids, Emulsifier (442), Flavour (Artificial (VANILLA CAKE) Flavouring Substances)",100,553,52.4,8.7,35.1,22.5,0.2,46.1,140,0,18,0,0,0,100,,,,
383,Kinder Creamy Milky And Cocoa With Extruded Rice,KINDER JOY,CHOCOLATE,CHOCOLATE,"Sugar, Skimmed Cow Milk Powder (22%), Palmolein, Palm Oil, Extruded Rice (7.7%), Low Fat Cocoa Powder (2.6%), Emulsifier (Lecithin - INS 322), Powdered Barley Malt Extract, Emulsifier (Lecithin - INS 322), Powdered Barley Malt Extract, Nature-Identical Flavouring Substances",100,539,55.4,8.4,31.3,14.2,0,48.8,134,0,0.7,0,VITAMIN B12(mcg) 1.07,0,30,,,,
384,Hershey's Kisses Cookies 'N' Cream Chocolate,HERSHEYS,CHOCOLATE,CHOCOLATE,"White Chocolate (89%): Milk Solids (34%), Sugar, Cocoa Butter, Cookies (11%): Wheat Flour, Sugar, Edible Vegetable Oil (Palm Oil), Cocoa Solids (10.3%), Emulsifier 322(I), Acidity Regulator 500(II), and Milk Solids, Emulsifiers (476 and 322(I))",100,530,58,9.3,32.9,0,0,31.2,0,0,0,0,0,0,57,,,,
385,Hershey's Exotic Raspberry & Goji Dark Chocolate,HERSHEYS,CHOCOLATE,CHOCOLATE,"Center (55%): Sugar, Liquid Glucose, Fruit Pulp (10.1%) ((Papaya (9.7%), Raspberry (0.2%), Gojiberry (0.2%)), Stabilisers (440,414,331 (iii)), Acidulant (296). Chocolate (45%): Sugar, Cocoa solids (29.4%), Cocoa butter, Milk solids, Emulsifier (322(i)), Liquid glucose, Stabiliser (1400), Edible common salt and Glazing agent (904)",100,451,80.4,1.97,13.5,8,0.05,57.6,0,0,0,0,0,0,65,,,,
386,Cadbury Temptations Almond Treat Premium CHOCOLATE BAR,BOURNVILLE,CHOCOLATE,CHOCOLATE BAR,"Sugar, Almonds (17%), Cocoa Butter, Milk Solids, Cocoa Solids, Fractionated Fat, Emulsifiers (442,476), Flavours (Natural, Nature Identical And Artificial (VANILLA CAKE) Flavouring Substances). Contains Cocoa Butter Equivalent In Addition To Cocoa Butter.Allergen Information: Contains Milk, Almonds, Soy May Contain Other Tree Nuts",100,555,53.4,9,35,18.5,0.1,45.2,81.5,0,12.4,0,0,0,130,,,,
387,Amul Dark CHOCOLATE BAR,AMUL,CHOCOLATE,CHOCOLATE BAR,"Sugar, Cocoa Solids, Cocoa Butter, Permitted Emulsifiers (E322, E476). Contains Added Flavours (Artificial Flavouring Substances - Cocoa and VANILLA CAKE)",100,521,51.4,6.4,33.1,18.6,0,43,38,0,0,0,0,0,200,,,,
388,Hershey's Exotic Dark Chocolate Californian Almonds - With Blackberry Crunchy Dark Chocolate,HERSHEYS,CHOCOLATE,CHOCOLATE,"Center (30%): Roasted almonds (29%), Stabilizers (415,1400), Anticaking agent (551) and Blackberry fruit powder (0.15%). Chocolate (70%): Sugar, Cocoa solids (20%), Cocoa butter, Milk solids, Liquid glucose, Emulsifier (322(i)), Stabiliser (1400), Edible common salt and Glazing agent (904)",100,564,50.8,8.5,36.3,12.5,0.07,36.5,0,0,,0,0,0,70,,,,
389,Cadbury Temptations Rum & Raisins Premium CHOCOLATE BAR,BOURNVILLE,CHOCOLATE,CHOCOLATE,"Sugar, Raisins (18%), Cocoa Butter, Cocoa Solids, Milk Solids, Fractionated Fat, Emulsifiers (442, 476), Flavours (Natural, Nature Identical, and Artificial (Rum, Raisin, VANILLA CAKE) Flavouring Substances)",100,498,62.2,5.7,26,17.5,<0.1,57,82.3,0,11.7,0,0,0,130,,,,
390,Nestle KitKat Delights Caramel,NESTLE,CHOCOLATE,CHOCOLATE BAR,"Milk Chocolate (68.9) (Sugar, Milk solids (16.6), Cocoa butter (12), Cocoa solids (8.2), Emulsifier (Soy lecithin), Nature identical (Cream Caramel) flavouring substances & Artificial (VANILLA CAKE) flavouring substances), WAFER(Refined Wheat flour (Maida), Sugar, Hydrogenated vegetable fats, Cocoa solids (0.68), Milk solids, Fractionated vegetable fat, Yeast, Raising agent (500(ii)), Emulsifier (Soy lecithin), Flour treatment agent (516), lodized Salt, Artificial (VANILLA CAKE) flavouring substances & Nature identical Flavouring substances)",100,441,49.9,6,24.1,22.7,0.03,42.9,82.7,0,1.1,0,0,0,90,,,,
391,Bounty Miniatures Coconut Filled Chocolate Pack,BOUNTY,CHOCOLATE,CHOCOLATE BAR,"Milk chocolate coating (44%) (Sugar, Milk solids, Cocoa butter, Cocoa solids, Edible vegetable fat less than 5% (Palm oil). Emulsifier (322)); Centre filling (Desiccated coconut (18%), Sugar Liquid glucose, Emulsifier (471). Hu,ectant (422), Salt)",100,490,59.4,3.9,25.8,20.5,0.11,50,100,0,5.1,0,0,0,169,,,,
392,Cadbury Dairy Milk Silk Hazelnut CHOCOLATE BAR,CADBURY,CHOCOLATE,CHOCOLATE BAR,"Sugar, Milk Solids (21%), Hazelnuts (16%), Cocoa Butter, Cocoa Solids, Emulsifiers (442, 476), Flavours (Natural, Nature Identical, and Artificial VANILLA CAKE)",100,566,51.4,8.7,36.8,19.2,0.1,46.6,104,0,23.1,0,0,0,100,,,,
393,"Snickers Filled with Brownie, Peanuts & Caramel CHOCOLATE BAR",SNICKERS,CHOCOLATE,CHOCOLATE BAR,"Milk chocolate (35%): (Sugar, Milk solids, Cocoa butter, Cocoa solids, Dextrose, Edible vegetable fat <5% (Sal fat, Palm oil), Emulsifier (322)); Centre filling (65%): (Liquid glucose, Peanuts (13%), Sugar, Cocoa solids (9.6%), Milk solids, Edible vegetable fat (Palm oil, Sesame oil), Invert sugar, lodized salt, Nature identical flavour, Cocoa butter, Emulsifier (322)).",100,494.9,59.3,7.3,26.1,12.7,0.3,50.3,293.1,0,16.1,0,0,0,70,,,,
394,Cadbury Dairy Milk Lickables Chocolate with Oreo Chunks,CADBURY,CHOCOLATE,CHOCOLATE,"Sugar, Palm Superolein, Milk Solids (11%), Biscuit 10% (Refined Wheat Flour (Maida), Sugar, Palmolein, Invert Sugar, Cocoa Solids, Leavening Agents (500)(i), 503(i), lodised Salt, Emulsifier (322), Flavours (Artificial (VANILLA CAKE) Flavouring Substances)), Cocoa Solids, Wheat crispies 5%* (Refined Wheat Flour (Maida), Sugar, Starch, lodised Salt, Cocoa Powder, Palm Kernel Oil, Leavening Agents (450 (1), 500(i), 341 (1))), Mineral, Stabilizing Agent (1400), Hydrogenated Vegetable Fat, Emulsifiers (442, 476), Flavours (Natural, Nature Identical, Artificial (Caramel and VANILLA CAKE) Flavouring Substances)",100,490,59.2,7,25.9,15,0.2,48.8,222,7.1,,0,0,0,50,,,,
395,Hershey's Kisses Choco Truffle,HERSHEYS,CHOCOLATE,CHOCOLATE,"Milk Chocolate (Sugar, Milk Solids, Cocoa Solids, Cocoa Butter, Edible Vegetable Oil (Sunflower and Palm), Emulsifiers (322, 476), Flavour (Artificial Flavouring Substance - Vanillin)), Center Filling (Edible Vegetable Oil (Palm and Rapeseed), Sugar, Milk Solids, Cocoa Solids, Emulsifiers (322, 476))",100,546,59,6.6,32,18,0.03,53,71.5,0,13,0,0,0,99,,,,
396,Amul Fruit 'N' Nut Chocolate,AMUL,CHOCOLATE,CHOCOLATE BAR,"Sugar, Cocoa Solids, Cocoa Butter, Almonds (8%), Raisins (5%), Permitted Emulsifiers (E322, E476), Added Flavours (Artificial Flavouring Substances - Cocoa and VANILLA CAKE)",100,556,55,7.1,34.2,17.5,0,37,0,0,0,0,0,0,200,,,,
397,Cadbury Dairy Milk Silk Desserts Plum Cake CHOCOLATE BAR,CADBURY,CHOCOLATE,CHOCOLATE BAR,"Milk Chocolate (60%)- Sugar, Mik Solids (15%) Cocoa Butter Cocoa Solids, Emulsifiers (442, 476), Flavours (Natural, Nature Identical and Artificial (VANILLA CAKE) Flavouring Substances); Centre (40%)- Apple Orange Pieces (7%) (Invert Syrup, Humectant (422), Apple Puree Concentrate (1%) Liqud Glucose, Sugar, Wheat Fibre, Orange Juice Concentrate (0.4%) Refined Palm Oil Thickening Agent (440), Acidity Regulator (330), Flavour (Natural (Orange) Flavouring Substances), Colour (100)). Fractionated Fat Sugar Refined Wheat Flour (Maida), Cocoa Solids, Milk Solids, Interesterified Fat, Humectant (422), Water, Palmolein, Emulsifiers (322, 442, 476), Invert Syrup. Flavours (Natural (Plum Cake), Nature Identical and Artificial (VANILLA CAKE) Flavouring Substances), Lodized Salt, Raising Agents (500(Ii), 503()), and Antioxidant (307C)",100,533,55.6,6.9,32.6,17.4,0.1,43.9,145,0,18.5,0,0,0,140,,,,
398,Mars Caramel CHOCOLATE BAR,MARS,CHOCOLATE,CHOCOLATE BAR,"Sugar, Liquid glucose, Milk solids, Invert Sugar, Hydrogenated Oil, Cocoa Butter, Cocoa Solids, Fractionated Fat, Emulsifiers (442, 471, 476), Hydrolyzed Vegetable Protein, lodised Salt, Flavours (Natural, Nature Identical and Artificial (Caramel and VANILLA CAKE) Flavouring Substances).",100,450,70,4,16.8,8.4,0.1,16.6,169,0,11.2,0,0,0,80,,,,
399,"Fabelle Hazelnut Handcrafted Chocolate Truffles Inspired by Classic Desserts, Assorted Luxury Chocolates Gift Pack",FABELLE,CHOCOLATE,CHOCOLATE,"Milk chocolate (55%) (sugar, milk solids (13.4%), cocoa butter, cocoa solids, dextrose, stabilizer (carrageenan), emulsifiers [sorbitan tristearate (from palm oil), ammonium salts of phosphatidic acid (from sunflower oil), lecithin (from soyabean), nature identical flavouring substances), centre filling (hazelnut mousse (45%) (refined palm oil, sugar, nuts (10.0%) [hazelnut (5.0%), almondsi, cocoa solids, milk solids, emulsifiers (mono and diglycerides of fatty acids (from palm oil), lecithin (from soyabean), hydrogenated vegetable oil, nature identical flavouring substances])",100,585,48.4,7.7,40.5,21,0.1,38,113.7,0,0.01,0,0,0,135,,,,
400,Cadbury Bournville Rich Cocoa 70% Dark CHOCOLATE BAR,BOURNVILLE,CHOCOLATE,CHOCOLATE BAR,"Cocoa Butter, Cocoa Solids, Emulsifiers (442, 476), Milk Solids, Nature Identical Flavouring Substances, and Sugar",100,598,40.7,7.6,47.4,32.1,0.1,20.4,18,0,4.4,0,0,0,130,,,,
401,Cadbury Bournville Cranberry 50% Dark CHOCOLATE BAR,BOURNVILLE,CHOCOLATE,CHOCOLATE BAR,"Sugar, Cocoa Butter (24%), Cocoa Solids (18%), Dried Sweetened Cranberries (11%) (Cranberries, Sugar), Almonds (7%), Milk Solids, Emulsifiers (442, 476), Flavours (Natural and Nature Identical Flavouring Substances)",100,526,64.33,5.77,29.9,19,0.1,45.7,13.6,0,4.4,0,0,0,130,,,,
402,Cadbury Bournville Fruit & Nut 50% Dark CHOCOLATE BAR,BOURNVILLE,CHOCOLATE,CHOCOLATE BAR,"Sugar, Cocoa Butter (24%), Cocoa Solids (18%), Raisins (75%), Cashew Nuts (4%), Apricot Kernels (4%), Milk Solids, Emulsifiers (442, 476), Nature Identical Flavoring Substance",100,533,56.8,6.4,32.8,19.9,0.1,44.2,16,0,4.6,0,0,0,130,,,,
403,Amul India Twilight Tryst 55% Dark CHOCOLATE BAR,AMUL,CHOCOLATE,CHOCOLATE BAR,"Sugar, Cocoa Butter, Cocoa Solids, Permitted Emulsifiers (E322, E476), Contains Added Flavours (Artificial Flavouring Substances - Cocoa and VANILLA CAKE)",100,557,57.3,6,33.7,20.2,0,43,0,0,,0,0,0,200,,,,
404,Snickers Almond Filled CHOCOLATE BAR,SNICKERS,CHOCOLATE,CHOCOLATE BAR,"Milk Chocolate Coating (35%): Sugar, Milk Solids, Cocoa Butter, Cocoa solids, Lactose, Dextrose, Emulsifier (Soya Lecithin),Ethyl Vanillin; Centre Filling(65%): Milk Solids, Salt, Lactose, Milk Fat, Almonds, Glucose Syrup, Sugar, Hydrogenated egetable Oil (Palm Oil),Cocoa Butter, Cocoa solid Dextrose, Emulsifier (Soya Lecithin), Ethyl vanillin.",100,475,58.8,7,24,9.2,0.3,53,217,0,5.5,0,0,0,80,,,,
405,Cadbury Gems Surprise Ball Chocolate,CADBURY,CHOCOLATE,CHOCOLATE,"Sugar, Hydrogenated Oils, Milk Solids, Cocoa Solids (8%*), Refined Wheat Flour (Maida), Emulsifiers (414, 442, 476), Colours (171, 102, 133, 124, 127, 122, 132, 110), Glazing Agent (903), Liquid Glucose, Flavours (Natural, Nature Identical and Artificial (Caramel and VANILLA CAKE) Flavouring Substances)",100,469,75.9,3.5,17.5,17.1,0.2,70.8,38,0,2.4,0,0,0,50,,,,
406,Cadbury Bournville Rich Cocoa 50% Dark CHOCOLATE BAR,CADBURY,CHOCOLATE,CHOCOLATE BAR,"Sugar, Cocoa Butter (29%), Cocoa Solids (22%), Milk Solids, Emulsifiers (442, 476), Nature Identical Flavoring Substances",100,543,62.64,5.24,32.12,23,0.1,45.1,15.8,0,5.5,0,0,0,130,,,,
407,Amul Milk Chocolate Smooth And Creamy,AMUL,CHOCOLATE,CHOCOLATE BAR,"Sugar, Cocoa Butter, Milk Solids, Cocoa Solids, Permitted Emulsifiers (E322, E476). Contains Added Flavours (Artificial Flavouring Substances - VANILLA CAKE and Cocoa)",100,545,57.4,8.4,31.4,19,0,43.6,0,0,0,0,0,0,200,,,,
408,Amul Sugar Free Dark Chocolate,AMUL,CHOCOLATE,CHOCOLATE BAR,"Maltitol, Cocoa Solids, Cocoa Butter, Permitted Emulsifiers (322, 476), Artificial Flavouring Substances (Cocoa, VANILLA CAKE)",100,554,43,14.2,36.1,21.5,0,10,0,0,0,0,0,0,200,,,,
409,Hershey's Exotic Dark Blueberry And Acai Chocolate Share Bag,HERSHEYS,CHOCOLATE,CHOCOLATE,"Center (55%): Sugar, Liquid Glucose, Fruit Pulp (10.1%) (Papaya (9.7%), Blueberry (0.2%), Acai (0.2%)), Stabilisers (440,414,331(Iii)), Acidulant (296). Chocolate (45%): Sugar, Cocoa Solids (29.4%), Cocoa Butter, Milk Solids, Emulsifier (322(I)), Liquid Glucose, Stabiliser (1400), Edible Common Salt and Glazing Agent (904)",100,451,80.4,1.97,13.5,8,0.05,57.6,0,0,,0,0,0,175,,,,
410,Nova Nova Waffle Chocolates- Belgian Chocolate,NOVA NOVA ,CHOCOLATE,WAFFLE,"Belgian & Dark Chocolate [71.3% (Sugar, Hydrogenated Vegetable Oil ((Palm & Palm Kernel). Milk Solids, Cocoa Solids, Emulsifiers E322, E476)], All-purpose Flour, Milk, Sugar, Butter, White Chocolate Drizzle, Raising Agent (E500 ii) and VANILLA CAKE Essence",100,360,45,4,20,17,0,31,71,0,5,0,0,0,199,,,,
411,Nova Nova Choco Pockets- Classic Chocolate,NOVA NOVA ,CHOCOLATE,CHOCOLATE,"Sugar, Refined Wheat Flour, Edible Vegetable Oil (Palm Oil), Milk Solids, Invert Syrup, Cocoa Solids, Iodised Salt, Emulsifiers (Plant Origin) (E471, E472(e), E322), Flour Improver (E01100), Antioxidant (E319)",100,463,74,7,16,7,0,35,192,0,7,0,0,0,98,,,,
