S.No,Item name,Brand_Name,Category,Sub_Category,Ingredients,Serving_Size_g,Calories_kcal,Carbohydrates_g,Proteins_g,Total_Fat_g,Saturated_Fat_g,Trans_Fat_g,Sugar_g,Sodium_mg,Dietary_Fiber_g,Cholesterol_mg,Calcium_mg,Vitamin,Iron_mg,Price_INR,Source_of_Data,Collection_Date,Collected_By,Remarks
169,Thums Up X Force,THUMS UP,JUICE,SODA,"Carbonated Water, Acidity Regulator (338), Caffeine, Colour (150d), Preservative (211), Sweeteners 955,Sweeteners 950,  Flavours (Natural, Nature Identical, Artificial (Cola) Flavouring Substances)",100,0,0,0,0,0,0,0,3.3,0,0,0,0,0,40,,,,NO_DATA
170,Bombay Banta Masala Soda Soft Drink,BOMBAY BANTA,JUICE,SODA,"Carbonated Water, Citric Acid, Lemon Juice Reconstituted (2%), Acidity Regulator (INS 330), Added Flavours (Natural and Nature Identical Flavouring Substances - Jeera), Salt, Sugar, Class II Preservative (INS 211)",100,42,10.6,0,0,0,0,11,110,0,0,0,0,0,20,,,,
171,Paper Boat Swing Jeera Soft Drink,PAPER BOAT,JUICE,SODA,"Added Flavours (Natural and Nature Identical Flavouring Substances - Jeera), Cane Sugar, Citric Acid (INS 330), Co (INS 290),Apple 7%, Lemon 3%, Iodised Salt, Permitted Class-II, Permitted Natural Food Colour (INS 150D), Preservative (INS 211), Vitamin C (INS 300), Purified Water",100,46,11.5,0,0,0,0,11.5,285,0,0,0,0,0,50,,,,
172,Aloha Strawberry and Lime Flavoured Soft Drink,ALOHA,JUICE,SODA,"Carbonated Water, Sugar, Acidity Regulator INS 330,Acidity Regulator INS 331, Preservative (INS 211), Sweetener (INS 955), Nature Identical Flavour, Antioxidant (INS 300), Synthetic Colour (INS 124)",100,90,21.3,0,0,0,0,19.2,150.1,0,0,0,Vitamin C (mg) 17.8,0,30,,,,
173,Aloha Peach Flavoured Soft Drink,ALOHA,JUICE,SODA,"Carbonated Water, Sugar, Acidity Regulator INS 330,Acidity Regulator INS 331, Preservative (INS 211), Sweetener (INS 955), Natural & Nature Identical Flavour, Antioxidant (INS 300), Synthetic Colour INS 102,Synthetic Colour INS 122)",100,84,21.3,0,0,0,0,18.8,144.8,0,0,0,Vitamin C (mg) 17.0,0,30,,,,
174,Aloha Pudina Masala Soft Drink,ALOHA,JUICE,SODA,"Carbonated Water, Sugar, Acidity Regulator INS 330,Acidity Regulator INS 331), Preservative (INS 211), Sweetener (INS 955), Natural and Nature Identical Flavour, Antioxidant (INS 300), Synthetic Colour INS 102,Synthetic Colour INS 133), Cloudifier",100,84,20.6,0,0,0,0,19.1,160.3,0,0,0,Vitamin C (mg) 16.9,0,30,,,,
175,NEOPOP Mango Bliss Can,NEOPOP,JUICE,SODA,"Carbonated Water, Sugar, Alphonso Mango Pulp (5%), Acidity Regulator (INS 330), Preservative (INS 211), Permitted Natural Colour (Betacarotene), Natural and Nature-identical Flavours",100,40.7,10.2,0,0,0,0,9.5,0,0,0,0,0,0,60,,,,
176,NEOPOP Lemon Squeeze Can,NEOPOP,JUICE,SODA,"Carbonated Water, Sugar, Lemon Juice (2.5%), Acidity Regulator (330),  Preservative (211)",100,38.6,9.6,0,0,0,0,9.4,0,0,0,0,0,0,60,,,,
177,NEOPOP Orange Splash Can,NEOPOP,JUICE,SODA,"Carbonated Water, Sugar, Orange Juice (5%), Acidity Regulator (330), Preservative (211), Natural Colour (Betacarotene), Natural Flavours",100,40,10,0,0,0,0,9.5,0,0,0,0,0,0,60,,,,
178,Monster-S The Doctor Imported Energy Drink,MONSTER-S,JUICE,SODA,"Carbonated Water, Sucrose, Orange, Lemon, Glucose Syrup, Lemon Fruit, Natural Flavourings, Taurine (0.4%), Acidity Regulators Calcium Lactate, Acidity Regulators Sodium Citrate, Acid (Citric Acid), Panax Ginseng Root Extract (0.08%), Preservative (Potassium Sorbate), Antioxidant (Ascorbic Acid), Caffeine (0.03%), Vitamins B2,Vitamins B3,Vitamins B6,Vitamins B12, L-Carnitine L-Tartrate (0.004%), Sweetener (Sucralose), Sodium Chloride, D-Glucronolactone, Guarana Seed Extract (0.002%), Inositol, Maltodextrin",100,44.0,11,0,0,0,0,10,0,0,0,0,"Vitamin B6 (MG) 0.8,Vitamin 12 (mcg) 2.5,Vitamin B3 (mg)8.5,Vitamin B2 (mg) 0.7",0,370,,,,
179,Dr Pepper Sparkling Fruit Flavour Soft Drink,DR PEPPER,JUICE,SODA,"Carbonated Water, Sugar, Colour (Caramel E150d), Phosphoric Acid, Sweeteners Aspartame,Sweeteners Acesulfame K, Preservative (Potassium Sorbate), Flavourings Including Caffeine",100,19.6,4.9,0,0,0,0,4.9,0,0,,0,0,0,220,,,,
180,Bisleri Limonata Lemon and Mint Soft Drink,BISLERI,JUICE,SODA,"Water, Sugar, Clear Lemon Juice Concentrate (0.83%), Carbon Dioxide, Sodium Benzoate (INS 211), Malic Acid (INS 296), Sodium Citrate (INS 331(iii))",100,47,11.7,0,0,0,0,11.5,2.9,0,0,0,0,0,40,,,,
181,Limca Lemon Soft Drink,LIMCA,JUICE,SODA,"Added Flavours (Natural, Nature-Identical and Artificial Flavouring Substances - Lemon Flavour), Acidity Regulators INS 330, Acidity Regulators INS 331, Carbonated Water, Preservative (INS 211), Stabilizers INS 414,Stabilizers INS 471, Sugar",100,44,11.1,0,0,0,0,10.7,5.5,0,0,0,0,0,40,,,,
182,Dabur Hommade Lemon Concentrated Liquid,DABUR HOMMAD,JUICE,FRUIT BEVERAGE,"Water, Lime Juice, Lemon Juice Concentrate, Contains Permitted Class II Preservative (INS 224)",100,31,2.5,0,0,0,0,2.5,27,0,0,0,0,0,90,,,,
183,Sprite Lemon and Lime Soft Drink,SPRITE,JUICE,SODA,"Acidity Regulators INS 330,Acidity Regulators INS 331(III), Carbonated Water, Flavours (Natural Flavoring Substances), Preservative (INS 211), Sugar",100,49,12.2,0,0,0,0,11.7,0,0,0,0,0,0,40,,,,
184,7 Up Lemon Soft Drink,7 UP,JUICE,SODA,"Carbonated Water, Sugar, Acidity Regulators (330,Acidity Regulators 331,Acidity Regulators 296), Preservative (211)",100,47,11.7,0,0,0,0,11.7,18,0,0,0,0,0,100,,,,
185,7UP Nimbooz Soft Drink,7 UP NIMBOOZ,JUICE,SODA,"Water, Sugar, Concentrated Lemon Juice (0.7%), Acidity Regulators 331(Iii),Acidity Regulators 296,Acidity Regulators 330, Flavour (Natural Flavouring Substances), Iodised Salt, Stabilizer (445(Iii)), Preservative (202)",100,42,10.6,0,0,0,0,10.6,65,0,0,0,0,0,25,,,,
186,Mountain Dew Lemon Soft Drink,MOUMTAIN DEW,JUICE,SODA,"Carbonated Water, Sugar, Regulators 330,Regulators 331, Flavour (Natural Flavouring Substances), Preservative (211), Caffeine (13 Mg/100 G), Stabilizer (445 (iii)), Colour (102)",100,49,12.3,0,0,0,0,12.3,8,0,0,0,0,0,40,,,,
187,Pluckk Natural Tender Coconut Water With Real Malai Chunks,PLUCKK,JUICE,COCONUT WATER,"Tender Coconut Water (99.30%) ,Coconut chunks (0.70%)",100,46,11.52,0,0,0,0,10.76,9.98,0,0,0,0,0,100,,,,
188,Paper Boat Tender Coconut Water,PAPER BOAT,JUICE,COCONUT WATER,"Coconut water (99%), Sugar,Preservative (NSN)",100,22,5.5,0,0,0,0,5.5,8.5,0,0,0,0,0,55,,,,
189,Mirinda Orange Flavoured Soft Drink,MIRINDA,JUICE,SODA,"Carbonated Water, Sugar, Acidity Regulators 330, Acidity Regulators 331, Flavour (Natural Flavouring Substances), Sweeteners 955,Sweeteners 960, Preservative (211), Stabilizer (444), Colour (110)",100,28,6.9,0,0,0,0,6.8,7,0,0,0,0,0,40,,,,
190,Sting Energy Drink,STING,JUICE,SODA,"Carbonated Water, Sugar, Acidity Regulators 330,Acidity Regulators 331, Flavour (Natural and Nature Identical Flavouring Substances), Sequestrants 452(I),Sequestrants 385, Taurine, Caffeine (29 Mg/100 Ml), Preservatives 211,Preservatives 202, Sweeteners 955, Sweeteners 950, Colour (129), Inositol, Vitamins Premix",100,28,7,0,0,0,0,6.8,41,0,0,0,"Vitamin B3 (mg) 2.1, Vitamin B6 (mg) 0.3, Vitamin B12 (mcg) 0.2",0,20,,,,
191,Red Bull Energy Drink,RED BULL,JUICE,SODA,"Water, Sucrose, Glucose, Acidulant (Citric Acid), Carbon Dioxide, Taurine (0.4%), Acidity Regulators Sodium Bicarbonate,Acidity Regulators Magnesium Carbonate, Flavours (Natural and Artificial), Colour (Caramel), Caffeine (0.03%), Vitamins (Niacin, B6, B2, B12)",100,45,11,0,0,0,0,11,41,0,0,0,"Vitamin B6 (mg) 0.4, Vitamin B2 (mg) 0.2, Vitamin B12 (µg) 0.2",0,165,,,,
192,Gatorade Blue Bolt Zero Sugar Energy Drink,GATORADE,JUICE,SODA,"Water, Sugar (5.4%), Dextrose, Acidity Regulator (330), Mineral Salts, Flavour Emulsion (Flavouring Substances, Stabilizers (445), Colour (102))",100,1,0,0,0,0,0,0,45,0,0,0,0,0,50,,,,
193,Gatorade Orange Zero Sugar Energy Drink,GATORADE,JUICE,SODA,"Acidity Regulator (INS 330), Dextrose, Flavour Emulsion (Flavouring Substances), Colour (INS 110), Mineral Salts, Stabilizer (INS 444), Sugar, Water",100,24,0,0,0,0,0,0,48,0,0,0,0,0,50,,,,
194,Gatorade Lemon Zero Sugar Energy Drink,GATORADE,JUICE,SODA,"Water, Dextrose, Acidity Regulator (330), Mineral Salts, Flavour Emulsion (Flavouring Substances), Stabilizers (445), Colour (102)",100,24,0,0,0,0,0,0,48,0,0,0,0,0,50,,,,
195,Smoodh Chocolate Milk Drink,SMOODH,JUICE,MILKSHAKE,"Water, Double Toned Milk (40%), Sugar, Whey Powder, Milk Solids, Cocoa Solids (1%), Malt Extract, Emulsifiers ,Stabilizers INS 460(i),Stabilizers INS 471,Stabilizers INS 466, Stabilizers INS 407,Stabilizers INS 340,Stabilizers INS 452, Nature Identical Flavouring Substance (Chocolate), Iodised Salt",100,83.8,14.6,2.3,1.8,1.2,0.05,13.7,67.8,0,4.1,82.1,0,0,20,,27-10-2025,,
196,Smoodh Chocolate and Hazelnut Milk Drink,SMOODH,JUICE,MILKSHAKE,"Water, Double Toned Milk (40%), Sugar, Whey Powder, Milk Solids, Cocoa Solids (1%), Malt Extract, Emulsifiers, Stabilizers INS 460(i),Stabilizers INS 471,Stabilizers INS 466,Stabilizers INS 407,Stabilizers INS 340,Stabilizers INS 452, Chocolate, Hazelnut, Iodised Salt",100,83.8,14.6,2.3,1.8,1.2,0.05,13.7,67.8,0,4.1,82.1,0,0,20,,,,
197,Smoodh Toffee Caramel Milk,SMOODH,JUICE,MILKSHAKE,"MILK SOLIDS*, WATER, SUGAR, DEXTROSE, MALT EXTRACT, NATURAL COLOUR (INS 150c) (0.67%), EMULSIFIERS, STABILIZERS INS 460(1),STABILIZERS INS 471,STABILIZERS INS 466,STABILIZERS INS 407,STABILIZERS INS 340,STABILIZERS INS 452, COCOA SOLIDS,  CARAMEL, TOFFEE ,VANILLA CAKE, IODISED SALT.",100,88.6,15.9,2.2,1.8,1.2,0.05,15,74.2,0,4.1,81.6,0,0,20,,,,
198,Hershey's Chocolate Milkshake,HERSHEYS,JUICE,MILKSHAKE,"Water, Sugar, Milk Solids (8%), Cocoa solids (0.75%), Emulsifier 460(1),Emulsifier 466,Emulsifier 471, Mineral (Calcium carbonate), Sequestrant (339(ii)), Edible common salt, Mineral (Zinc sulphate), Vitamin E (Acetate), Vitamin A (Acetate), VitaminD2(Ergocalciferol), VitaminB1 (Thiamine chloride hydrochloride), Vitamin B2 (Riboflavin)",100,166.2,29.27,3.94,3.71,0,0,21.4,0,0,0,324,"Vitamin A (µg) 102.0, Vitamin D2 (µg) 1.8, Vitamin E (IU) 1.4, Vitamin B1 (mg) 0.4, Vitamin B2 (mg) 0.4, Zinc (mg) 3.2",0,40,,,,
199,Hershey's Cookies and Cream Milkshake,HERSHEYS,JUICE,MILKSHAKE,"Water, Mik Solids (11%), Sugar, Liquid Giucose, Mineral Caloium carbonate, Emusfiers 4600,Emusfiers 466 471, Cocoa Solids (0.25%), Flavours (Nature Identical and Atificial Flavounng Substances(Vanila loe cream), Edible Common Sat, Seguestrant (3911), Thickeners 415,Thickeners 407, Mineral (Zinc Sulphate), Vitamin E (Acetate), Vitarmin A (Acetate), Vitamin D2 (Ergocaloferol), Vitamin B1 (Thiamine Chloride Hydrochioride), Vitamin B2 (Riboltavin",100,161.3,29.7,3,3.3,2.5,0.2,29.6,182,0,4.2,324,"Vitamin E (IU) 1.4, Vitamin B1 (mg) 0.4, Vitamin B2 (mg) 0.4, Zinc (mg) 3.2",0,40,,,,
200,Hershey's Strawberry Milkshake,HERSHEYS,JUICE,MILKSHAKE,"Water, Sugar, Milk Solids (8%*), Emulsifier 460(i),Emulsifier 466,Emulsifier (471), Mineral (Calcium carbonate), Sequestrant (339 (ii), Thickening agent (415), Mineral (Zinc sulphate), Vitamin E (Acetate), Vitamin A (Acetate), Vitamin D2 (Ergocalciferol), Vitamin B1 (Thiamine chloride hydrochloride), Vitamin B2 (Riboflavin), Edible common salt.",100,155.6,28.5,3.6,3,0,0,21.4,103,0,0,324,"Vitamin A (µg) 135.0, Vitamin D2 (µg) 2.0, Vitamin E (IU) 1.6, Vitamin B1 (mg) 0.36, Vitamin B2 (mg) 0.36",40,40,,,,
201,Sunfeast Dark Fantasy Chocolate Milkshake With Belgian Chocolate,SUNFEAST,JUICE,MILKSHAKE,"Milk Solids (82.9%), Sugar, Water, Cocoa Powder (1.3%), Nature Identical Flavouring Substances, Stabilizers 407,Stabilizers412, Emulsifier Mono-and di-glycerides of fatty acids (from Palm oil)], Belgian Chocolate (0.1%), Acidity Regulator (339 (ili), Chocolate, VANILLA CAKE, lodized Salt,Contains Milk, Soy, May Contain Nut, Wheat, Oat",100,110,17.5,3.1,3.1,1.9,0,16.9,105,0,7.5,110,0,0,30,,,,
202,Creambell Choco Milkshake,CREAMBELL MILKSHAKE,JUICE,MILKSHAKE,"Toned Milk (85%), Potable Water, Sugar, Milk Solids, Cocoa Solids (1.3%), Emulsifying Agents (INS 471), Stabilizing Agents INS 407,Stabilizing Agents 412,Stabilizing Agents 415, Acidity Regulators INS 340 (ii),Acidity Regulators INS 340 (iii),Acidity Regulators INS 452 (i), Colour (INS 150d), Flavour Nature-Identical Flavouring Substances (Belgian Chocolate)",100,98,14,3.4,3.3,1.9,0,13.4,47.2,0,0,119,0,0,35,,,,
203,Creambell Coffee Milkshake,CREAMBELL MILKSHAKE,JUICE,MILKSHAKE,"Double Toned Milk (82%), Potable Water, Sugar, Milk Solids, Coffee Powder (0.4%), Emulsifying Agents (INS 471),Stabilizing Agents INS 407,Stabilizing Agents 412,Stabilizing Agents 415, Acidity Regulators INS 340 (ii),Acidity Regulators 340 (ii),Acidity Regulators 452 (i), Colour (INS 150d), Flavour Nature-Identical Flavouring Substances (Coffee)",100,84,14,3.4,1.6,1,0,13.8,49.9,0,0,125,0,0,30,,,,
204,Epigamia Turbo VANILLA CAKE and Caramel Protein Milkshake,EPIGAMIA,JUICE,MILKSHAKE,"Skimmed Milk (80%), Milk Solids, Water, VANILLA CAKE,Caramel, Acidity Regulators INS 340,Acidity Regulators INS 452,Acidity Regulators INS 339(ii), Stabilizers (INS 407), Sweetener (INS 955), Edible Common Salt",100,136,8,25,0.2,0,0,8,221,0,0,412,0,0,150,,,,
205,Phab 18g Protein Mango Magic Milkshake,PHAB,JUICE,MILKSHAKE,"Purifed Water, Protein 15% Milk Protein Concentrate,Protein 15% Milk Solids, Probiotic Fructooligosaccharide, Artificial Flavour Substances - Mango, Stabilizers INS 407,Mango, Stabilizers INS460(i),Mango, Stabilizers INS 466, Sequestrant INS 331 (iii),Sequestrant INS 452 (),Acidity Regulator INS 339(iii), Emulsifier (INS 471),Synthetic Food Colour INS 110,ynthetic Food Colour INS 102, Artificial Sweetener (INS 955)",100,125.9,8,18,0,0,0,0.5,102.6,4,7.7,0,0,0,135,,,,
206,Heritage Chocolate and Caramel Milkshake,HERITAGE,JUICE,MILKSHAKE,"Toned Milk, Sugar, Cocoa Powder, Emulsifier,Stabilizers INS 471,Stabilizers INS 412,Stabilizers INS 407 Acidity Regulator (INS339 (ii))",100,101.5,14.1,3.4,3.5,2.1,0.15,8.5,88,0,10,128,0,0,40,,,,
207,Heritage Pista Flavoured Milk,HERITAGE,JUICE,MILKSHAKE,"Toned milk, Sugar, Almond bits (0.6%), Malai, Saffron, Iodized salt, Natural food color (INS 150 c), Acidity regulator (INS339(ii)), Stabilizers (INS 407), Cardamom extract",100,83.9,14.3,3.3,1.5,1,0,14.3,40,0,6,130,"Vitamin A (mcg) 27, Vitamin D (mcg) 0.5",0,30,,,,
208,Heritage VANILLA CAKE Flavoured Milk,HERITAGE,JUICE,MILKSHAKE,"Double Toned Milk, Sugar, Synthetic Food Colour (E102),Artificial VANILLA CAKE Flavouring Substance",100,84,14.3,3.3,1.5,0,0,9.5,0,0,0,130,0,0,30,,,,
209,Nestle Milo Health Chocolate Drink with Millets,MILO,JUICE,MILKSHAKE,"Toned Milk (80%), Water, Sugar, Malted barley (1.4%), Millet (Bajra) (1.4%), Cocoa solids (1%), Acidity regulators 340(ii), Acidity regulators 341(ii), Stabilizers 412,Stabilizers 407, VitamINS, Sweetener (960),Mineral",100,80,11.4,2.9,2.5,1.9,0,8.1,49,0,6.6,89.2,"Vitamin B2 (mg) 0.44, Vitamin B3 (mg) 5.17, Vitamin B6 (mg) 0.59, Vitamin B12 (µg) 0.20",1.4,45,,,,
210,Amul Gold Kool Exotic Rose Flavoured Milk,AMUL,JUICE,MILKSHAKE,"Toned Milk, Sugar, Milk Solids, Synthetic Food Colour (127), Artificial Flavouring Substances (Rose)",100,164,22.5,5.6,5.7,3.5,0,,,,,,,,,,,,
211,Amul Kool Kesar Milk Drink,AMUL,JUICE,MILKSHAKE,"Toned Milk, Milk Solids, Sugar, Synthetic Food Colours 102,Synthetic Food Colours 110, Artificial Flavouring Substances (Kesar)",100,163,22.5,5.6,5.6,3.4,0,22.5,78,0,16,0,0,0,25,,,,
212,Amul Gold Kool Premium Kesar Flavoured Milk,AMUL,JUICE,MILKSHAKE,"Toned Milk, Sugar, Milk Solids, Synthetic Food Colours 102,Synthetic Food Colours 110, Artificial Flavouring Substances (Kesar)",100,164,22.5,5.6,5.7,3.5,0,22.5,78,0,16,0,0,0,30,,,,
213,Amul Taaza Homogenised Toned Milk (Tetra Pack),AMUL,JUICE,MILKSHAKE,"Toned Milk Fat 3.0% Minimum,Toned Milk Snf 8.5% Minimum",100,58.2,4.8,3,3,2,0,4.8,37,0,10,110,0,0,77,,,,
214,Amul Gold Kool Royal Elaichi Flavoured Milk,AMUL,JUICE,MILKSHAKE,"Toned milk, sugar, milk solids, synthetic food colours 102,synthetic food colours 133, artificial flavouring substances (elaichi)",100,164,22.5,5.6,5.7,3.5,0,22.5,78,16,0,0,0,0,30,,,,
215,Nescafe Ready To Drink Coffee Flavoured Milk Iced Latte Cold Coffee,NESCAFE,JUICE,COFFEE,"Double Toned Milk (87%), Sugar, Coffee (0.8%), Acidity Regulator (339(ii)), Stabilizer (407), Iodized Salt",100,126,19.4,5.8,2.9,2.5,0,16.9,171.5,0,7.2,0,0,0,45,,,,
216,BRU Classic Cold Coffee Tetra Pack,NESCAFE,JUICE,COFFEE,"Double Toned Milk, Sugar, Milk Solids, Coffee (0.62%), Stabilizers INS 1440,Stabilizers INS 460 (i),Stabilizers INS 466,Stabilizers INS 407, Acidity Regulator (INS 339 (ii))",100,138,22.2,7,2.5,1.75,0.08,21.8,232,0.2,11,0,0,0,45,,,,
217,Nescafe Cafe Style Iced Frappe Cold Coffee,NESCAFE,JUICE,COFFEE,"Toned milk (48%), Water, Sugar, Dried glucose syrup, Coffee (0.8%), Stabilizers 466,Stabilizers 460(i), Acidity regulators 500(ii),Acidity regulator 332(ii), Emulsifier (322(i)), Thickener (415), Iodized salt",100,54,9.7,1.4,1.1,1.1,0,6.2,51.8,0,2.9,0,0,0,50,,,,
218,Nescafe Ready To Drink Coffee Flavoured Milk Intense Cafe Cappucino Cold Coffee,NESCAFE,JUICE,COFFEE,"Double Toned Milk (87%), Sugar, Coffee (0.8%), Acidity Regulator (339(ii)), Nature-Identical (Cappuccino) Flavouring Substances,Stabilizer (407)",100,126,19.4,5.8,2.9,2.5,0,16.9,165.4,0,7.2,0,0,0,45,,,,
219,Cravova Hazelnut Cold Coffee,CRAVOVA,JUICE,COFFEE,"Milk solid, Sugar, Coffee, Natural Flavoring Substance",100,83.2,11.5,3,2.8,1.8,0.1,11.4,0,0,8,100,0,0,50,,,,
220,Cravova Mocha Cold Coffee,CRAVOVA,JUICE,COFFEE,"Milk, Milk Solids, Sugar, Coffee (0.8%), Cocoa Powder (0.25%), Acidity Regulator (INS 339(ii)),Stabilizer (INS 418)",100,83.2,11.5,3,2.8,1.8,0.1,11.4,0,0,8,100,0,0,50,,,,
221,"Tata Cold Coffee Belgian Chocolate Iced Coffee, Rich & Creamy, Flavoured Milk",TATA COFFEE GRAND,JUICE,COFFEE,"Water, Sugar, Coffee, Nature-Identical Flavouring Substance, Cocoa Powder, Stabilisers, Chicory,,Preservative",100,31,7,0.2,4.8,3.6,0,7.0,203,0,11.9,212.7,0,0,70,,,,
222,Dairy Day Bento Cake Choco Fantasy Ice Cream Cake - Box,DAIRY DAY,CAKE,ICECREAM CAKE,"Ice Cream (45%): Milk Solids, Water, Cocoa Solids, Sugar, Emulsifier INS 477,Emulsifier 471, Stabiliser INS 410,Stabiliser 412, Contains Added Flavour - Nature Identical Chocolate Flavouring Substances. Eggless Chocolate Cake (24%): Wheat Flour, Water, Edible Vegetable Oil, Raising Agents (INS 341(ii)), Corn Starch, Emulsifier, Stabiliser INS 415,Stabiliser 433,Stabiliser 471,Stabiliser 475, Dextrose, Salt, Baking Powder, Choco Compound Chips (15%) , Edible Vegetable Fat, Cocoa Solids, Emulsifier (INS 322), Chocolate Flavoured Non Dairy Whip Cream (9%), Cherry, Chocolate Syrup (7%) Water, Milk Solids, Sugar, Vanillin, Stabiliser (INS 415)",100,279,39,4.3,11.8,9,0,39,68.9,0,12.9,0,0,0,199,,,,
223,Winkies Cake - Chocolate Cake Slice,WINKIES,CAKE,CHOCOLATECAKE,"REFINED WHEAT FLOUR (MAIDA), SUGAR,EGGS, BAKERY SHORTENING, WATER, PALM OIL, HUMECTANTS INS 422,HUMECTANTS INS 420, LIQUID GLUCOSE, COCOA SOLIDS (2%), INVERT SYRUP, MIXED FRUIT JAM, MILK SOLIDS, NATURAL FOOD COLOUR (INS 150d), CAKE GEL INS 471, CAKE GEL INS 477, CAKE GEL INS 1520, CAKE GEL INS 420, CAKE GEL INS 412, RAISING AGENT [INS 500(ii)], BAKING POWDER, EDIBLE COMMON SALT, PRESERVATIVE INS 282,PRESERVATIVE INS 200, ACIDITY REGULATOR (INS 260), ARTIFICIAL FLAVOUR(S),CHOCOLATE AND VANILLA CAKE, STABILIZER INS 412,STABILIZER INS 415), EMULSIFIERS INS 471,EMULSIFIERS INS 477,EMULSIFIERS INS 322, NATURE-IDENTICAL FLAVOUR (ORANGE).",100,427.9,52.1,7.2,21.1,12.8,0.1,29.5,230.5,0,127.6,0,0,0,30,,,,
224,The Baker's Dozen VANILLA CAKE Cake,THE BAKER'S DOZEN,CAKE,VANILLA CAKE,"Wholewheat Flour (27%), Sunflower Oil,Sugar, Condensed Milk, Apple Cider Vinegar, Baking Powder, Raising Agent (INS 500 (ii)), lodized Salt, Preservatives INS 202,Preservatives INS 282, CONTAINS ADDED ARTIFICIAL FLAVOURING SUBSTANCES (VANILLA CAKE)",100,380,48,6,18,2,0,22,125,2,0,0,0,0,165,,,,
225,The Baker'S Dozen Fresh Orange Cake,THE BAKER'S DOZEN,CAKE,ORANGE CAKE,"Refined Wheat Flour (Maida), Sugar, Orange Juice (21%) ,Water, Sugar, Orange Concentrate (20.40%)^, Orange Pulp (0.5%)^, Vitamin C, Flavour (Natural Flavouring Substances), Sunflower Oil, Condensed Milk, Apple Cider Vinegar, Orange Peel Candy (1%), Baking Powder, Raising Agent (INS 500 (ii)), lodized Salt, Preservatives INS 202,Preservatives INS 282.",100,358,55,5,13,2,0,32,135,2,0,0,0,0,175,,,,
226,Britannia Gobbles Bar Cake - Fruity Fun,BRITANNIA,CAKE,CAKE,"Refined Wheat Flour (Maida), Egg, Sugar, Vanaspati, Fruit Products (7.4%),Glazed Fruits Papaya Cuts,Glazed Fruits Preservative (202), Colours 124,Colours 110, Orange Pulp, Interesterified Vegetable Fat, Humectant (422), Refined Palmolein Oil, Liquid Glucose, Dextrose, High Maltose Syrup, Fructooligosaccharides, Cake Gel,Emulsifiers 471,Emulsifiers 477,Emulsifiers470(i), Humectants 1520,Humectants 422), Edible Maize Starch, Wheat Starch, Raising Agents (341(i),Raising Agents 500(ii),Raising Agents 450(vii),Raising Agents 450(i), Nature Identical, Artificial (Mixed Fruit, Creamy VANILLA CAKE) Flavouring Substances, lodised Salt, Invert Sugar Syrup, Preservatives 202,Preservatives 282, Acidity Regulator (330), Baking Powder, Emulsifier (475), Stabilizer (415), Colour (102).",100,450,59,5.7,17.3,9,0,30.1,252.6,0,81.7,0,0,0,30,,,,
227,The Baker's Dozen Banana Bread 100% Wholewheat,THE BAKER'S DOZEN,CAKE,BANANA BREAD,"Sugar, Wholewheat Flour (18%), Bananas (18%), Sunflower Oil, Whole Egg Powder, Banana Powder (2%), Raising Agent (INS 500 (ii)), Preservatives INS 202,Preservatives INS 282",100,393,44,7,21,4,0,21,70,4,0,0,0,0,175,,,,
228,The Baker's Dozen Wholewheat Banana Walnut Cake,THE BAKER'S DOZEN,CAKE,BANANAWALNUT CAKE,"Sugar, Banana (19%), Sunflower Oil, Wholewheat Flour (Atta) (14%), Walnuts (13%), Whole Egg Powder, Banana Powder (2%), Raising Agent (INS500()), Preservative INS202,Preservative INS282.",100,448,43,9,27,2,0,22,60,3,0,0,0,0,190,,,,
229,Britannia Fudge It Chocolate Brownie (With Egg),BRITANNIA,CAKE,BROWNIE,"SUGAR, REFINED WHEAT FLOUR (MAIDA), REFINED PALMOLEIN OIL, EGGS, CHOCO CALLETS (10%),SUGAR, HYDROGENATED VEGETABLE FAT, COCOA SOLIDS, EMULSIFIER (491), DEXTROSE, EMULSIFIER (322(i)), NATURAL FLAVOURING SUBSTANCES, MILK CHOCOLATE CHIPS (8%) , COCOA BUTTER, MILK SOLIDS, COCOA SOLIDS, DEXTROSE, EMULSIFIER (322(i)), NATURAL FLAVOURING SUBSTANCES, COCOA SOLIDS (2%), HIGH MALTOSE SYRUP, LIQUID GLUCOSE, IODISED SALT,BROWNIE MAGNUM, VANILLA CAKE FLAVOURING SUBSTANCES, COLOUR (150d), EMULSIFIER (471), PRESERVATIVES 202,PRESERVATIVES 282, STABILIZER (415), BAKING POWDER,ACIDITY REGULATOR (330).",100,470,58.5,5,24,13,0,40.8,174,0,44.5,0,0,0,90,,,,
230,Winkies Fruit Cake Slice,WINKIES,CAKE,FRUIT CAKE,"REFINED WHEAT FLOUR (MAIDA), EGGS, SUGAR, BAKERY SHORTENING, WATER, PALM OIL, FRUIT CUTS (6%), HUMECTANTS INS 422,HUMECTANTS INS 420, LIQUID GLUCOSE, MIXED FRUIT JAM, MILK SOLIDS, INVERT SYRUP, CAKE GEL INS 471, CAKE GEL INS 477, CAKE GEL INS 1520,CAKE GEL  INS 420,CAKE GEL INS 412, RAISING AGENT [INS 500(ii)], BAKING POWDER, EDIBLE COMMON SALT, PRESERVATIVES INS 282,PRESERVATIVES  INS 200, ACIDITY REGULATOR (INS 260), STABILIZER INS 412,STABILIZER  INS 415, EMULSIFIERS INS 471,EMULSIFIERS INS 477, EMULSIFIERS INS 322, NATURAL FLAVOUR (LEMON), NATURE-IDENTICAL FLAVOUR (ORANGE) AND ARTIFICIAL FLAVOUR (VANILLA CAKE)",100,425.7,53.9,6.2,20.5,12.1,0.1,34.6,186.9,0,107.2,0,0,0,30,,,,
231,Britannia Gobbles Marble Red Velvet Cake,BRITANNIA,CAKE,CAKE,"REFINED WHEAT FLOUR MAIDA, SUGAR, EGGS, REFINED VEGETABLE FAT CIINTERESTERIFIED VEGETABLE FAT, SESAME OIL, EMULSIFIER (471), ANTIOXIDANT (319) & VITAMIN AJ, HUAIECTANTS [422, 420(II)], REFINER PALMOLEIN OIL, HIGH MALTOSE SYRUP, LIQUID GLUCOSE, EDIBLE MAIZE STARCH, CAKE GEL (EMULSIFIERS AND STABILIZERS (471 & 477) AND HUMECTANT [420(II)]), RAISING AGENTS (341(1), 500(II), 450(1)), CAKE MIX [COLOUR (162), EMULSIFIER (471)), IODISED SALT, INVERT SUGAR SYRUP, NATURE IDENTICAL & ARTIFICIAL (VANILLA CAKE, CHEESE) FLAVOURING SUBSTANCES, COCOA SOLIDS (0.3%), PRESERVATIVES (202, 200, 282), BAKING POWDER, ACIDITY REGULATOR (330). STABILIZER (415), COLOURS(129, 122, 124)",110,414,54.4,0,17.2,8.8,0,20,235,0,0,0,0,0,30,,,,
232,Winkies Swiss Roll Chocolate,WINKIES,CAKE,SWISS ROLL,"Refined Wheat Flour, Sugar, Eggs, Water, Liquid Glucose, Humectants, Cocoa Solids, Cake Gel, Palmolein Oil, Milk Solids, Emulsifiers, Natural Food Colour, Raising Agent, Edible Common Salt, Acidity Regulator, Preservatives, Artificial Flavour, Starch, Stabilizer, Liquid Glucose, Bakery Shortening, Margarine, Dextrose, Invert Syrup",100,407.83,59.1,6.75,15.91,4.21,0.09,28.81,103.66,0,0,0,0,0,100,,,,
233,Modern Pineapple Pop Cake,MODERN,CAKE,CAKE,"Sugar, Refined Wheat Flour (Maida), Eggs, Edible Vegetable Fat (Margarine), Edible Vegetable Oil (Sunflower Oil), Glazed Fruit cuts (520/0) (Papaya, sugar, Acidity Regulator (330), Preservative (211), CONTAINS PERMITTED SYNTHETIC FOOD COLOR (102), Pineapple Cuts (0.4%)), Humectants (422, 420(ii)), Maize Starch, Cake Mix [Thickener (1414), Emulsifier (471), Raising Agents (500(li), 450(1)), Stabilizer (415)], Cake Gel [Emulsifiers (471, 477, 470(i)) and Humectants (420(ii), 422)], Liquid Glucose, Invert syrup, Acidity Regulators (341(1), 330), Preservatives (282, 200), Baking Powder, Raising Agent (500(ii)) and lodized Salt",100,407,53,5,19.5,8.5,0,27.65,91.5,0,0,0,0,0,35,,,,
