S.No,Item name,Brand_Name,Category,Sub_Category,Ingredients,Serving_Size_g,Calories_kcal,Carbohydrates_g,Proteins_g,Total_Fat_g,Saturated_Fat_g,Trans_Fat_g,Sugar_g,Sodium_mg,Dietary_Fiber_g,Cholesterol_mg,Calcium_mg,Vitamin,Iron_mg,Price_INR,Source_of_Data,Collection_Date,Collected_By,Remarks
643,Maggi Special Masala Instant Noodles,MAGGI,INSTANT FOOD,NOODLES,"Noodles: Refined wheat flour (Maida), Palm oil, Wheat gluten, lodized salt, Thickeners (508 & 412), Acidity regulators (501(1) & 500 (1)) and Humectant (451(1)). Masala Tastemaker: Mixed spices (35.2%) (+Roasted spice powder (9.3%) (Coriander, Turmeric, Cumin, Aniseed, Black pepper, Fenugreek, Ginger, Green cardamom, Cinnamon, Clove, Nutneg, Bay leaf & Black cardamom), Red chilli powder, Onion powder, Garlic powder, Black pepper powder, Coriander powder, Turmeric powder, Cumin powder, Ginger powder, Aniseed powder, Fenugreek powder, Capsicum extract, Com-pounded asafoetida, Star anise powder, Coriander extract & Cumin extract), Sugar, lodized salt, Refined wheat flour (Maida), Onion, Thickener (508), Starch, Flavour enhancer (635), Yeast extract powder, Palm oil, Dehydrated kasuri methi leaves, Acidity regulator (330), Corn oil, Mineral and Wheat gluten",100,397,60.3,9.6,13.1,7.7,0.13,2.3,939.3,0,0,0,0,6.9,20,,,,
644,Gits Paneer Tikka Masala Ready to Eat,GITS,INSTANT FOOD,CURRY,"Onion. Cottage Cheese (21%), Tomate, Water, Capsicum, Red Chilli, Cashewnut, Yoghurt, Sunflower oil, Ghee, Salt, Garlic, Coriander. Ginger, Green chilli, Corn flour, Coriander seeds, Fennel seeds, Sugar, Cumin seeds. Turmeric, Green cardamom, Fenugreek seeds, Mustard, Fenugreek leaves. Caran seeds, Cinnamon Black pepper, Stararise, Dry bay leaf. Cardamom. Nutmeg. Black salt, Clove, Dry manga & Pomegranate",100,164,6,8,12,6.2,0,0.2,290,0,8,87,Vitamin A (mcg) 218,0.8,160,,,,
645, Gits Veg Biryani Ready to Eat,GITS,INSTANT FOOD,BIRIYANI,"Basmati Rice (58%), Potato Water Tomato, Color, Yoghurt, Peas, Sunflower Oil, Steelclarified Butter, Ginger, Garlic, Red Chillies, Coriander, Mint Salt Turmeric, Cinnamon, Camin, Black Pepper, Bay Leaves, Green Cardamon, Black Cardamom, Caraway Seeds, Nutmeg, Mace, Cloves, Star Anise, Fennel Seeds Rose Mater Sallon & Kewra Water",100,157,23,3.3,5.8,2,0.01,0,575,0,4,95,Vitamin A  (mcg) 85,1,160,,,,
646,Eastern 5 Min Instant Breakfast Idiyappam Ready Mix,EASTERN,INSTANT FOOD,IDIYAPPAM,"Rice Flour (97%), Refined Wheat Flour (Maida), Iodized Salt",100,343,78,7.7,0.5,0,0,0.7,389,2.2,0,0,0,0,99,,,,
647,Currychief Madras Sambar,CURRYCHIEF,INSTANT FOOD,SAMBAR,"Water, Shallots, Onion, Tomato, Toor Dal, Moong Dal, Sunflower Oil, Salt, Red Chilly, Asafoetida, Green Chilly, Coriander, Fenugreek, Turmeric, Mustard, Cumin, Pepper, Rice, Channa Dal",100,178,18.3,7.4,8.3,0,0,12.8,0,1.2,0,0,0,0,120,,,,
648,MTR Dosa Instant Mix,MTR,INSTANT FOOD,DOSA,"Rice flour (46%), Blackgram Dal (27%), Refined Wheat Flour, Edible Vegetable fat-interesterified (Palm Oil and Palm kernel oil), Salt, Leavening agent: Sodium bicarbonate (INS 500(ii)), Acidity Regulator: Malic Acid (INS 296), Fenugreek",100,362,65,12,6,3,0,0,1340,5.5,0,0,0,0,155,,,,
649,Cookd Black Pepper Kit,COOKD,INSTANT FOOD,MASALA POWDER,"Onion ((37%)), Water, Edible Vegetable Oil Refined Sunflower Oil, Garlic ((8%)), Soy Sauce, Ginger, Black Pepper, Iodized Salt, Vinegar, Flavour Enhancers (ins 627, Ins 630), Thickener (ins 1422), Hydrolysed Vegetable Protein, Yeast Extract, and Stabilizing Agent (ins 415) and Colour (ins 1500)",100,238.32,36.51,6.27,7.47,1.04,0,2.38,956.15,0,0,0,0,0,199,,,,
650,MTR Roasted Vermicelli,MTR,INSTANT FOOD,VERMICELLI,Wheat Semolina (Suji / Rawa),100,341,75,8,1,0,0,0,8,0,0,0,0,0,67,,,,
651,Aashirvaad Rava Idli Instant Mix,AASHIRVAAD,INSTANT FOOD,RAVA IDLI,"Semolina (86.3%), Refined Wheat Flour (Maida), Refined Palm Oil, Lodized Salt, Bengal Gram Dal (1.4%), Raising Agent [INS 500 (ii)], Dehydrated Carrot (1.2%), Curry Leaves (0.9%), Spices and Condi-ments, Mustard Seeds (0.5%), Ca-shewnuts (0.4%) and Dehydrated Green Chilli Powder",100,368,74.8,8.8,3.7,1.2,0.03,1.7,1242.5,0,0,0,0,0,300,,,,
652,MTR Breakfast Rava Dosa Mix,MTR,INSTANT FOOD,RAVA DOSA,"Semolina (45%), Rice, Refined Wheat Flour, Edible Vegetable fat-interesterified, Salt, Cumin, Green Chilli Powder, Acidity Regulator: Malic Acid (INS 296)",100,350.5,73,9,2.5,1,0,0,560,3.85,0,0,0,0,160,,,,
653,Yu Cheesy VEG Carbonara - Korean Ramen Noodles,YU FOODS,INSTANT FOOD,NOODLES,"Black Pepper, Butter, Celery, Cheddar Cheese, Corn Flour, Cream, Dry Red Chilli, Garlic, Ginger, Onion, Orange Peel, Peanuts, Salt, Sesame Seeds, Soy Sauce, Sugar, Sunflower Oil, and Wheat Flour",100,195,20,5.3,6.1,2.7,0,4.2,347,3.4,0,0,0,0,67,,,,
654,Too Yumm K-Bomb Ramen Hot n Spicy Instant Noodles,TOO YUMM,INSTANT FOOD,NOODLES,"Noodles: Refined Wheat Flour, Vegetable Oil (Rice Bran Oil), Iodized Salt, Wheat Gluten, Starch, Gelling Agent (INS 508), Sequestrant (INS 451(i)), Thickeners (INS 412), Acidity Regulators (INS 501(i), INS 500(i)) Seasoning Mix: Iodized Salt, Sugar, Spices and Condiments (Contains Onion, Garlic, Chilli), Natural and Nature Identical Flavouring Substances, Maltodextrin, Fermented Soya Sauce Powder, Hydrolysed Vegetable Protein, Tomato Powder, Vinegar, Acidity Regulator (INS 330), Flavour Enhancers (INS 627, INS 631), Anticaking Agent (INS 551), Colour (INS 150d), Dehydrated Herb (Celery) Used as natural flavouring agent Garnish: Dehydrated Cabbage, Spices and Condiments (Chilli), Iodized Salt, Sugar",100,431,66,11.4,13.7,3.7,0,4,1852,0,0,0,0,0,50,,,,
655,Maggi Nutri-licious Masala Veg Atta Noodles,MAGGI,INSTANT FOOD,NOODLES,"Herbs, Spices, Vegetables, Wheat Flour (Atta)",100,314,50.4,7.7,10.3,8.5,0.15,2.5,798.9,0,0,0,0,6.62,30,,,,
656,Maggi Korean BBQ Veg Instant Noodles,MAGGI,INSTANT FOOD,NOODLES,"NOODLES: Refined wheat flour (Maida), Palm oil, Wheat gluten, Iodized salt, Thickeners (508 & 412), Acidity regulators (501(i) & 500 (i)) and Humectant (451(i)). TASTEMAKER: Sugar, Soya sauce powder (Soya sauce, Maltodextrin, Iodized salt, Color (150c)), Garlic powder, Red chilli powder (11%), Thickener (508), Iodized salt, Flavour enhancer (635), Natural flavouring substance, Onion powder, Nature identical flavouring substances, Spice extract blend, Palm oil, Curry spice extract blend, Acidity regulator (330), Black pepper, Cinnamon powder, Star anise powder, Colour (150d), Sunflower oil and Rosemary extract. OIL: High oleic sunflower oil, Curry spice extract blend and Spice extract blend",100,321,41.6,8.2,13.5,7.6,0.14,3.2,915.7,0,0,0,0,0,60,,,,
657,YiPPee! Magic Masala Noodles with Added Veggies,SUNFEAST,INSTANT FOOD,NOODLES,"Instant Noodles: Refined Wheat Flour (Maida) (78.4%), Refined Palm Oil, Lodized Salt, Wheat Gluten (0.4%), Thickeners (INS 508, INS 412), Stabilizers (INS 170(1), INS 339(1), INS 450(), INS 452(0)] and Acidity Regulators [INS 501(1), INS 500(1), INS 330) Masala Mix: Dehydrated Vegetables [Beans (9.5%), Carrot (7.1%), Onion (4.6%) and Cabbage (3.8%), Instant Noodle Powder (Refined Wheat Flour (Maida) (15.5%), Refined Palm Oil, Lodized Salt and Wheat Gluten (0.08%)), Spices and Condiments (17.6%) (Garlic, Coriander, Cumin, Ginger, Chilli, Aniseed, Fenugreek, Black Pepper, Cardamom, Nutmeg, Caraway, Cinnamon, Clove and Turmeric), Sugar, Lodized Salt, Hydrolyzed Vegetable Protein, Natural Flavours and Natural Flavouring Substances, Nature Identical Flavouring Substances, Maltodextrin, Yeast Extract, Acidity Regulator (INS 330), Flavour Enhancers (INS 627, INS 631), Anticaking Agent (INS 551), Mineral, Vitamins and Starch",100,459,62.6,9,20.1,10.7,0.1,3,1247.1,0,0,128.5,"Vitamin C (mg) 6.0, Vitamin B9 (mcg) 17.7",2.6,120,,,,
658,Sunfeast Yippee! Korean Noodles Fiery Hot,SUNFEAST,INSTANT FOOD,NOODLES,"Instant Noodles: Maida (Refined Wheat Flour), Refined Palm Oil, Starch, Lodized Salt, Emulsifier (Mono and diglycerides of fatty acids (from Palm Oil)), Wheat Gluten, Thickener (INS 466), Acidity Regulators JINS 500(ii), INS 501(1), INS 330), Stabilizers [INS 339(il), INS 450(i)). Seasoning: Spices and Condiments (20.2%) (Dried Garlic, Red Chilli, Dried Ginger, Black Pepper, Spice Oleoresin), Hydrolyzed Vegetable Protein (Soya Protein Isolate, Maltodextrin), Instant Noodle Powder (Maida (Refined Wheat Flour), Refined Palm Oil, Starch, Lodized Salt, Wheat Gluten), Maltodextrin, Lodized Salt, Dehydrated Onion, Sugar, Soyabean Sauce Powder Soyabean Sauce, Maltodextrin), Flavour Enhancers (INS 627, INS 631]. Nature Identical Flavouring Substances, Yeast Extract, Anticaking Agent (INS 551), Natural Flavours and Natural Flavouring Substances, Thickener (INS 415), Acidity Regulator (INS 330). Dehydrated Vegetables (100.0%) [Cabbage (32.8%), Carrot (32.8%), Spring Onion (22.9%), Beans (6.6%), Zucchini (4.9%))",100,439,64.7,8.5,17.1,8.6,0.1,2.7,1770.6,0,0,0,0,0,55,,,,
659,Yu Zingy Cheese Instant Cup Noodles,YU FOODS,INSTANT FOOD,NOODLES,"Refined Flour Noodles, Cheddar Cheese, Onions, Garlic, Spring Onion, Corn Kernel, Tomato Puree, Palm Oil, Corn Flour, Milk, Vinegar, Refined Oil, Salt, Sugar, Red Chilli Powder, Spices and Seasoning, and Water",100,347,31.8,6.3,21.6,7.2,0.2,7.7,914,0,0,0,0,0,69,,,,
660,Bambino Elbow Macaroni Pasta,BAMBINO SOUTH,INSTANT FOOD,PASTA,"Durum Wheet Semelina/Rave Vitamins And Minerals Premix (Vitamin B3 (Es Niacinamide), Iron Las Ferrous Sulphate), Zinc (As Zinc Sulphate), Vitamin B2 (Riboflavin), Vitamin B1 (Es Thiemine Mononitrate and Vitamin B9 (Folic Acid)",100,357,75,12,1,0.2,0,2,0,0,0,3,"Vitamin B1 (mg) 0.42, Vitamin B2 (mg) 0.48, Vitamin B3 (mg) 5.4, Vitamin B9 (mcg) 60",2.4,56,,,,
661,Del Monte Penne Rigate Pasta Durum Wheat,DEL MONTE,INSTANT FOOD,PASTA,Durum Wheat Semolina,100,350,71,12,1.2,0.3,0,3.2,0,3.5,0,0,0,0,280,,,,
662,Ruchi magic Garlic Pickle,RUCHI,INSTANT FOOD,PICKLE,"Garlic Cloves and Crushed (22%), Potable Water, lodized Salt, Refined Rice Bran Oil, Tamarind, Jaggery, Chilli, Mixed Spices, Ginger Paste, Split Bengal Gram Dhal (Dal Chana), Split Black Gram (Urad Dal), Acidity Regulators (INS 330 & INS 260), Asafoetida and Preservative (INS 211)",100,123,5,2.5,10,2.5,0,2,1200,0,0,0,0,0,110,,,,
663,MasterChow Hot and Spicy Schezwan Chutney,MASTER CHOW,INSTANT FOOD,CHUTNEY,"Water, Red Chilli Paste (25%), Garlic (12%), Tomato Paste, Sugar, Refined Soyabean Oil, Ginger (7%), Celery (3%), Iodized Salt, Soya Sauce, Acidity Regulators (INS260 and INS330), Sichuan Peppercorn, I+G, Mixed Spices & Condiments, Paprika Oleoresin, and Preservative (INS211)",100,146,17.6,2.1,7.4,1.5,0.1,13.8,2256,0,0,0,0,0,98,,,,
664,Priya Lime Pickle In Lime Juice With Garlic,PRIYA,INSTANT FOOD,PICKLE,"Lime (61%), Iodised Salt, Lime Juice (7.5%), Garlic (5%), Chilli Powder, Fenugreek Powder, and Turmeric Powder",100,72,12.8,2,1.4,0.1,0,0.3,728.4,0,0,0,0,0,110,,,,
665,Keya Malabar Chicken Pickle,KEYA,INSTANT FOOD,PICKLE,"Chicken (40%), Spices and Condiments (Red Chilli, Ginger, Garlic, Fenugreek and Mustard), Edible Vegetable Oil, Iodised Salt, Acidity Regulator (INS 260), Sugar and Preservative (INS 211)",100,202,7.2,12.5,13.6,0,0,0,4,0,0,0,0,0,320,,,,
666,The Little Farm Co. Mixed Gobhi Gajar Shalgum Pickle,THE LITTLE FARM CO,INSTANT FOOD,PICKLE,"Gobhi, Shalgum, Carrots, Red chilli, Himalayan pink salt, Garam masala, Rai, Jaggery, Sugarcane vinegar, Cold pressed mustard oil, Ginger, Garlic, Citric Acid",100,118,13,1,9,0,0,13.0,0,0,0,0,0,0,250,,,,
667,Dnv Appalam,DNV,INSTANT FOOD,PAPPAD,"Urad Dal, Flour, Refined Salt, Asafoetida, Sodium Carbonate, Rice Flour, Sunflower Refined Oil",100,83,1.4,18.5,0.6,0,0,0,218,0,0,13.9,Vitamin C (mg) 0.9,0,50,,,,
668,Wellfry Sabudana Red Chilli Papad,WELLFRY,INSTANT FOOD,PAPPAD,"Sabudana (Teploca) Red Chill, Rock Salt",100,333.9,79.64,6.65,0.1,0,0,0,80,0,0,0,0,0,85,,,,
669,Del Monte Sliced Black Olives,DEL MONTE,INSTANT FOOD,PICKLE,"Olives (48.5%), Water, Iodized Salt, Color Retention Agent (Ins 579)",100,125,3,0.5,13,2.3,0.1,0,720,3,0,0,0,0,210,,,,
670,Priya Mango Avakaya Pickle With Garlic,PRIYA,INSTANT FOOD,PICKLE,"Mango (59%), Iodized Salt, Refined Rice Bran Oil, Mustard Powder, Chilli Powder, Sesame Oil, Garlic (4%), Mustard Oil and Mixed Spices",100,206,14.9,3.1,14.9,2.3,0,8.9,523.1,0,0,0,0,0,110,,,,
671,Daishik Green Chutney,DAISHIK,INSTANT FOOD,CHUTNEY,"Coriander, Mint Powder, Green Chilli, Bengal Gram, and Iodized Salt",100,401.7,76.3,14.8,8.2,0,0,0,191.4,0,0,0,0,0,85,,,,
672,MTR Instant Badam Drink Mix,MTR,INSTANT FOOD,BADAM DRINK MIX,"Sugar, Milk Solids, and Almond",100,57.4,12,0.72,0.72,0.06,0,11.4,8,0,0,0,0,0,295,,,,
673,MTR Schezwan Idli Mix,MTR,INSTANT FOOD,IDLI,"Sooji, Sprouted Millets (Jowar, Ragi) (8%), Corn, Cashew (4%), Desi Ghee (4%), Sunflower Oil, Urad Dal, Chana Dal, Sundried Vegetables (Carrot, Onion, Green Chilli, Curry Leaves). No Maltodextrin Seasoning: Salt, Jaggery Powder, Mustard, Cumin, Fennel, Ginger, Black Pepper, Herbs (Oregano, Basil), Hing, Natural & Nature Identical Flavours (Lemon), Vitamin E.",100,340,67,13,2.3,1.1,0,47,0,0,0,0,0,0,160,,,,
674,MTR Gourmet Butter Idli Mix,MTR,INSTANT FOOD,IDLI,"Rice, Black Gram Dal, Edible Vegetable Oil, Salt, Acidity Regulator, Raising Agent",100,340,67,13,2.3,1.1,0,47,0,0,0,0,0,0,160,,,,
675,Gits Khaman Dhokla Instant Snack Mix,GITS,INSTANT FOOD,DHOKLA,"Besan (Chick Pea Flour 68%), Sugar Powder, Semolina, Salt, Citric Acid (E330), Sodium Bicarbonate (E500(Ii)), Asafoetida, Turmeric and Sodium Acetate (E262) (Acidity Regulator)",100,370,67,16,4.2,0.4,0,19,1821,11.35,0,47,"Vitamin A (mg) 95.0, Vitamin C (mg) 0.74",0,150,,,,
676,Golden Prize Tuna Spread In Mayonnaise,GOLDEN PRICE,INSTANT FOOD,MAYONNAISE,"Baby Corn, Carrot, Guar Gum (E412), Mayonnaise, Natural Colour (E171), Onion, Salt, Sugar, Sweet Corn, Sweet Pepper, Tuna, and Vinegar",43,36,3.2,4.4,0.6,0,0,1,250,0,0,0,0,0,265,,,,
677,Cookd Tandoori Tikka Kit,COOKD,INSTANT FOOD,MASALA POWDER,"Marinade: spices and condiments (chilli, coriander, cumin, ginger, turmeric, black pepper), iodized salt, garlic powder, tomato solids, corn starch, dehydrated herbs, flavour enhancers (INS627, INS631), acidity regulator (INS330), thickener (INS 451), natural flavour. Sprinkler: black salt, mango powder, spices and condiments (cumin, coriander, black pepper, ginger), dehydrated herbs, natural flavour. Oil: spice extract (mustard), natural flavour, mustard oil",100,316.7,32.6,11.59,16.34,2.56,0,3.88,910.8,17,0,0,0,0,149,,,,
678,Wok N Roll Manchurian Masala,WORK N ROLL,INSTANT FOOD,MASALA POWDER,"Acidity Regulator (INS 330), Anticaking Agent (INS 551), Corn Starch, Flavour Enhancer (INS 635), Garlic Powder, Ginger Powder, Green Chilli Powder, Hydrolysed Vegetable Protein (Corn), Low Sodium Salt Iodized, Malt Extract (Wheat and Barley), Maltodextrin (Corn), Manchurian Seasoning (Refined Sunflower Oil, Spice Extracts (Capsicum, Ginger, Celery, Black Pepper, Garlic), Emulsifier (INS 471), Natural and Nature Identical Flavouring Substances), Natural Flavouring Substances, Onion Powder, Soya Sauce Powder (Soya Flour, Acidity Regulators (INS 260, INS 330), Maltodextrin (Corn)), Spice Mix (Onion Powder, Garlic Powder, Ginger Powder), Sugar",100,360,53.3,3.9,0.1,0,0,11.3,4340,0,0,0,0,0,64,,,,
679,Happa Cereal Sprouted Ragi | Mango | Banana,HAPPA,INSTANT FOOD,CEREAL,"Organic Ragi (68%), Banana Powder (19%), Mango Powder (13%)",100,385,86.9,5.5,1.8,0.9,0,19.8,36.9,0,0,0,0,0,299,,,,
680,Gladful Choco Pancake Sprouted Millets and Masoor Mix,GLADFUL,INSTANT FOOD,PANCAKE MIX,"Sprouted Masoor, Foxtail Millet, Oats, Jawar, Banana, Chocolate, Raw Unrefined Cane Sugar, VANILLA CAKE, Baking Powder",30,307,61.9,10,2.1,0,0,18.9,360,4.5,0,0,0,0,149,,,,
681,Madmix Oats Idli With Free Chutney,MADMIX,INSTANT FOOD,OATS IDLI,"Oats Idli Premix: Rice, Gram, Oats, Baking powder, Salt, and Fruit salt. Chutney Premix: Gram, Coconut Powder, Salt, Green Chilli Powder, Curry Leaves Powder, Cumin Powder, Ginger Powder, Asafoetida",100,361.88,73.94,11.75,1.61,0.36,0,0,488.49,0,0,0,0,0,149,,,,
682,Surya Panipuri Masala,SURYA,INSTANT FOOD,MASALA POWDER,"Black Salt, Dry Mango, Mint Leaves, Rock Salt, Tamarind Powder, Black Pepper, Salt, Citric Acid, Cumin, Ginger, Chilli Powder, Ajwain and Asafoetida",100,32.0,7,1,0,0,0,0,2050,0,0,0,0,0,44,,,,
683,Currychief Chicken Curry,CURRYCHIEF,INSTANT FOOD,MASALA POWDER,"Coconut, Garlic, Ginger, Onion, Salt, Shallots, Spices and Condiments (Chilli, Cinnamon, Cloves, Coriander, Curry Leaves, Cumin, Fennel Seeds, Pepper, Turmeric), Sunflower Oil, Tomato, and Water",100,76.8,0.5,2.5,7.2,0,0,0.9,0,0.0,0,0,0,0,150,,,,
684,Hocco Pindi Chole Rice Combo,HOCCO,INSTANT FOOD,CHOLE RICE,"Basmati Rice, Bay Leaf, Black Cardamom, Black Pepper, Butter, Cardamom, Chaat Masala, Chick Peas, Cinnamon, Cloves, Cotton Seed Oil, Cream, Edible Common Salt, Fenugreek, Green Chilli, Kitchen King, Mace, Onion, Pomegranate Seed Dry, Pure Ghee, Salt, Star Anise, Tomato, and Water",375,453.96,30.89,14.15,30.42,9.45,0,14.15,1359.79,0,0,0,0,0,185,,,,
685,Hocco Chana Masala,HOCCO,INSTANT FOOD,MASALA POWDER,"Chickpeas White (Kabuli Chana 28%), Tomato Puree, Black Pepper, Sunflower Oil, Cotton Seed Oil, Onion, Cumin, Spices (Cumin Seed Powder, Red Chilli Powder, Cinnamon, Cardamom, Clove), Salt, Garlic, Green Chilli, Ginger, and Water",100,277.16,26.45,3.6,17.4,11.25,0,2.1,385.67,0,0,0,0,0,140,,,,
686,Hocco Bisebelle Bhath,HOCCO,INSTANT FOOD,BISEBELLE BHATH,"Beans, Carrots, Curry Leaves, Mustard Seeds, Peas, Rice, Tamarind, Toor Dal, and Turmeric",100,114.29,18.62,2.64,3.25,1.29,0,2.35,427.51,0,0,0,0,0,140,,,,
687,Hocco Mumbai Bhaji,HOCCO,INSTANT FOOD,MUMBAI BHAJI,"Potato, Tomato, Water, Capsicum, Cotton Seed Oil, Clarified Butter, Onion, Green Peas, Coriander, Red Chilli, Salt, Garlic, Cabbage, Cumin, White Pepper, Kashmiri Chilli Powder, Cinnamon, Clove, Turmeric, and Black Pepper",150,222,25,3,12,9,0,0,600,0,0,0,0,0,140,,,,
688,Hocco Smoked Paneer,HOCCO,INSTANT FOOD,SMOKED PANEER,"Bengal Gram, Black Cardamom, Black Gram, Black Pepper, Cardamom, Cashew Nut, Cassia, Chilli, Clarified Butter, Clove, Coriander, Cotton Seed Oil, Cumin, Dried Whole Milk, Dry Ginger, Fenugreek, Fenugreek Leaves, Garlic, Mace, Melon Seed, Mustard, Nutmeg, Onion, Paneer, Red Chilli, Salt, Star Anise, Tomato Paste, and Turmeric",150,358.5,37.5,8.25,19.5,10.5,0,0,150,0,0,0,0,0,170,,,,
689,Real Thai Rice Paper,REAL THAI,INSTANT FOOD,RICE PAPER,"Rice 90%, Water, Tapioca Flour, Salt",24,80,19,1,0,0,0,0,340,0,0,0.48,1.44,0,219,,,,
690,Pintola Organic Wholegrain Brown Rice Cakes,PINTOLA,INSTANT FOOD,RICE CAKE,"100% Organic Wholegrain Brown Rice, Desert Salt",100,378,81,7.9,2.2,0.2,0,0,71.2,7.1,0,0,0,5,160,,,,
691,Wakao Jackfruit Biryani,WOKAO,INSTANT FOOD,BIRIYANI,"Water, Basmati Rice, Jackfruit, Tomato paste, Onion, Garlic, Ginger, Thickening agent (INS 1422), Spices and Condiments, Soybean oil, Green chilies, Curd, Rose Water, Kewra Water, Coriander Leaves, Mint Leaves, Wheat Fiber, Added natural and nature identical flavors and color",100,105.44,21.09,2.61,1.67,0.87,0,5.6,382.24,0.79,0,0,0,0,200,,,,
692,Hocco Dal Makhani,HOCCO,INSTANT FOOD,DAL MAKHANI,"Black Gram, Clarified Butter, Cotton Seed Oil, Coriander Powder, Fenugreek Leaves, Garlic, Ginger, Green Chilli, Milk Cream, Onion, Red Chilli Powder, Salt, Sugar, Tomato, Tomato Powder, Veg Seasoning, and Water",100,378.68,46.13,4.64,19.52,11.04,0,0,481.11,0,0,0,0,0,170,,,,
693,Hocco Dum Aloo,HOCCO,INSTANT FOOD,DAM ALOO,"Onion, Potato, Fried Cashewnut, Cashewnut, Melon Seed, Curd, Spice Mix, Garam Masala Powder, Black Pepper Powder, Cloves, Green Cardamom, Black Cardamom, Star Anise, Mace, Cumin Seed, Coriander Whole, Garlic, Ginger, Khoya, Fresh Cream, Salt, Kasoori Methi, Turmeric Powder, and Water",150,110.33,23.33,2.16,0.93,0,0,3.84,193.18,4.26,0,47.13,0,2.8,140,,,,
694,Gits Heat & Eat Pau Bhaji,GITS,INSTANT FOOD,PAU BHAJI,"Tomato (32%), Potato (31%), Butter, Onion, Green Peas (5%), Capsicum (3%), Red Chillies, Garlic, Salt, Ginger, Coriander, Cumin, Carom Seeds, Black pepper, Aniseed, Split gram, Cinnamon, Green cardamom, Star anise, Clove, Nut meg, Mace, Stone flower, Black salt, Bay leaf and Black cardamom",100,159,14.9,5.7,8.8,3.7,0.1,0,465,0,14,100,Vitamin A(mcg)140,2,135,,,,
695,Knorr Chinese Manchurian Gravy Mix,KNOR,INSTANT FOOD,GRAVY MIX,"Corn Flour, Sugar, Dehydrated Vegetables (Onion, Garlic, Leeks), Iodised Salt, Flavour Enhancer - 621, Chillies, Dehydrated Ginger Bits, Hydrogenated Palm Oil, Hydrolyzed Vegetable Protein, Acidity Regulator - 296",100,324,67.3,8.1,2.5,1.2,0.02,22.3,670.9,2.1,0,0,0,0,60,,,,
696,Wakao Hot & Spicy Sausage,WAKAO FOODS,INSTANT FOOD,SAUSAGE ,"Water, Jackfruit (16.3%), Refined Sunflower Oil, Potato Starch, Soy Protein, Thickeners (INS 461, INS 415, INS 407), Spices and Condiments, Natural and Artificial Flavours, Iodized Salt, Flavour Enhancers (INS 627, INS 631), Sugar, Herb (0.2%), Acidity Regulator (Citric Acid)",100,160.5,7.2,5.7,12.1,1.8,0,1.8,856.4,5.2,0,0,0,0,350,,,,
697,Kitchens Of India Rajma Masala,KITCHENSOF INDIA,INSTANT FOOD,MASALA POWDER,"Water, Rajmah (24.4%), Tomato (7.7%), Onion (7.7%), Refined Sunflower Oil, Spices and Condiments (1.1%), Iodized Salt, Ginger, Garlic, Tomato Paste and Dehydrated Fenugreek Leaves",100,116,15.4,4,4.2,1.5,0.1,0,0,0,0,0,0,0,130,,,,
698,Nestle Cerelac Wheat Apple Carrot Baby Food Cerea,NESTLE,INSTANT FOOD,CEREAL,"Wheat flour (Atta) (58%), Milk solids (31.8%), Apple juice concentrate (11.4%), Soyabean oil, Carrot juice concentrate (1.1%), Minerals, Vitamins and Enzyme (Alpha amylase)",100,427,65,15,12.5,5.5,0.08,20,0,3,10,0,0,0,275,,,,
699,Nestle Cerelac Multigrain & Fruits Baby Food Cereal,NESTLE,INSTANT FOOD,CEREAL,"Wheat flour (Atta) (48.1%), Milk solids (32.7%), Cereal discs (Corn flour (6.7%), Barley flour (2.2%)), Orange juice concentrate (4.6%), Sugar, Soyabean oil, Dehydrated apple bits (2.4%), Cherry flakes (1.7%), Minerals, Vitamins and Enzyme* (Alpha amylase)",100,412,68.1,15,9.4,4.8,0.04,23.5,0,2.4,12,0,0,0,294,,,,
700,Slurrp Farm No Added Sugar,SLURRP FARM,INSTANT FOOD,CEREAL,100% sprouted ragi,100,377.8,81.3,8.7,1.9,0.5,0,0,4.3,4.7,0,0,0,0,299,,,,
701,Slurrp Farm Ragi Rice Strawberry Instant Healthy Cereal,SLURRP FARM,INSTANT FOOD,CEREAL,"Multigrain flour blend (sprouted ragi, jowar, rice, oats) (47%), milk solids (33%), fruit powder blend (banana, strawberry) (10%), date powder (9%), beet juice powder, vitamins, and minerals",100,375.9,76.7,13.1,1.8,0.9,0,11.7,80,5.2,0,600,"Vitamin A (mcg) 400.0, Vitamin C (mg) 40.0, Vitamin D (mcg) 5.0, Vitamin E (mg) 2.5, Vitamin B1 (mg) 0.5, Vitamin B2 (mg) 0.6, Vitamin B6 (mg) 0.9, Vitamin B12 (mcg) 0.6",9,349,,,,
702,Slurrp Farm No Added Sugar Cereal - Ragi Rice and Mango with Milk,SLURRP FARM,INSTANT FOOD,CEREAL,"Supergrain blend (sprouted ragi, Jowar, Rice) (35%), Milk solids (30%), Mango powder (11%), Oat flour (10%), Date powder (9%), Skimmed milk powder, Vitamins and minerals",100,386.7,80.8,13.4,1.1,0.5,0,15,27.5,6.4,0,600,"Vitamin A (mcg) 400.0, Vitamin C (mg) 40.0, Vitamin D (mcg) 5.0, Vitamin E (mg) 2.5, Vitamin B1 (mg) 0.5, Vitamin B2 (mg) 0.6, Vitamin B6 (mg) 0.9, Vitamin B12 (mcg) 0.6",9,349,,,,
703,The Select Aisle Dark Chocolate Chips,THE SELECT AISLE,INSTANT FOOD,CHOCO CHIP,"Sugar, Edible Vegetable Fat (Hydrogenated), Cocoa Solids, Dextrose, and Emulsifier (INS 322)",100,558,62,2.7,33,0,0,54,0,0,0,0,0,0,169,,,,
704,Puramate Tooty Fruity Mix,PURAMATE,INSTANT FOOD,TOOTY FRUITY,"Papaya Pieces, Sugar, Citric Acid (E330), Contains Permitted Class II Preservatives (E211)",100,302.09,74.3,0.66,0.25,0.2,0.1,71,0,0,0,0,0,0,45,,,,
705,Betty Crocker Triple Chocolate Brownie Instant Cake Mix Powder,BETTY CROCKER,INSTANT FOOD,CAKE MIX,"Sugar, Refined Wheat Flour (Maida), Cocoa Powder (6.35%), Dark Compound Choco Chips (6.0%) (Sugar, Cocoa Solids, Hydrogenated Vegetable Oil (Palm), Dextrose, Emulsifier (Ins492, Ins322)), White Compound Chips (6%) (Sugar, Milk Solids, Edible Vegetable Fat (Palm), Emulsifier (Ins322)), Edible Vegetable Oil (Palm), Iodized Salt, Raising Agent (Is341(Ii)), Stabilizer (Ins415)",100,381.4,81.6,3.4,4.6,2.2,0.1,54.3,228,0,0,0,0,0,450,,,,
706,Pillsbury VANILLA CAKE Custard Powder,PILLSBURY,INSTANT FOOD,CUSTARD POWDER,"Cornflour, Lodised Salt, Nature Identical and Artificial Flavouring Substances - VANILLA CAKE, Colours - (INS 102, INS 110, INS 122)",100,360,89.8,0.2,0,0,0,0,0,0,0,0,0,0,84,,,,
707,Amul Mithai Mate Condensed Sweetened Milk Tin,AMUL,INSTANT FOOD,CONDENSED MILK,"Sugar, Milk Solids",100,331,55,7.5,9,5.4,0,55,100,0,27,270,0,0,130,,,,
708,Hershey's Cocoa Powder,HERSHYEYS,INSTANT FOOD,COCO POWDER,Cocoa,100,409,57.9,19.6,11,0,0,1.75,33.2,0,0,0,0,0,140,,,,
709,Nestle Milkmaid Partly Skimmed Sweetened Condensed Milk,NESTLE,INSTANT FOOD,CONDENSED MILK,"Milk Solids, Sugar",100,303,58.4,8.5,3.9,2.9,0,58.4,110,0,11,0,0,0,147,,,,
710,Double Horse Rice Palada Payasam Mix,DOUBLE HORSE,INSTANT FOOD,PAYASAM MIX,"Sugar 60%, Rice, Cardamom, Cocoa",25,69,16,1,0,0,0,0,35,0,0,0,0,0,95,,,,
711,Pillsbury Butterscotch Flavour Pancake Mix,PILLSBURY,INSTANT FOOD,PANCAKE MIX,"Refined Wheat Flour (Maida), Sugar, Butterscotch Bits (7.0%)[Sugar, Edible Vegetable Fat (Hydrogenated), Iodized Salt and Artificial Flavouring Substances (Butterscotch)], Edible Vegetable Oil (Palm), Baking Powder [INS500(ii), INS541(i)], Iodized Salt, Artificial Flavouring Substances (Caramel, Butterscotch) and Raising Agent [INS500(ii)]",100,381,73.2,8.2,5.8,2.7,0,20.6,728,0,0,0,0,0,125,,,,
712,MTR Gulab Jamun Mix,MTR,INSTANT FOOD,GULAB JAMUN MIX,"Acidity Regulator (INS 296), Edible Vegetable Fat Interesterified (Palm Kernel Oil and Palmolein Oil), Milk Solids, Raising Agent (INS 500 ii), and Refined Wheat Flour (Maida)",100,390,60,14.6,10.4,6.6,0,3.3,710,0,0,0,0,0,145,,,,
